2439,345,"Of course I have! What do you think, I’m some 30 year old virgin?",Monica,6,2,34,4,6,15,"00:18:08,504","00:18:13,446",34_4_test
2440,712,They don’t look any bigger than me!,Ross,0,0,73,1,4,15,"00:11:35,111","00:11:36,778",73_1_test
2441,8706,"And he'll be all, 'Yes!'",Joey,6,2,869,13,3,12,"00:13:14,960","00:13:16,795",869_13_train
2442,3755,We don’t care about where we stay.,Woman,0,0,374,11,8,3,"0:15:52,827","0:15:55,061",374_11_train
2443,104,"Come on man!  Listen so uh, are you gonna squeeze the perps shoes a little bit before he lawyers up?",Joey,4,1,10,3,5,20,"00:07:01,254","00:07:07,342",10_3_dev
2444,9730,Okay.,Phoebe,0,0,966,7,8,10,"0:02:17,554","0:02:18,034",966_7_train
2445,8860,But I couldn’t.,Ross,0,0,887,10,6,17,"0:19:51,773","0:19:53,125",887_10_train
2446,3412,Yes!,Rachel,4,1,338,8,4,18,"0:16:28,790","0:16:29,620",338_8_train
2447,6343,"I will be! Listen, I don’t want you teaching my son that stuff anymore. Okay?",Ross,6,2,634,0,7,16,"00:11:58,592","00:12:06,182",634_0_train
2448,6101,"Oh, you Americans always butcher the French language.",Phoebe,0,0,613,7,7,3,"00:18:45,207","00:18:47,792",613_7_train
2449,2007,"My roommate bet me five bucks that I couldn’t, and then he stuck a board through the handles that locked me in.",Joey,0,0,201,4,4,2,"00:13:45,950","00:13:50,912",201_4_test
2450,10333,"Alright, and if you’re gonna put your feet up, why don’t you sit on the-",Monica,5,2,1025,1,6,9,"0:11:52,420","0:11:54,214",1025_1_train
2451,9056,I cannot get on a plane without one!,Rachel,4,1,905,13,1,11,"0:03:16,321","0:03:18,053",905_13_train
2452,3026,"He’s right, even if it’s to say something complementary.",Ross,0,0,302,4,3,13,"00:17:11,488","00:17:15,324",302_4_train
2453,2043,What?! It is?!,Ross,1,1,203,1,8,14,"00:06:28,440","00:06:30,660",203_1_train
2454,7514,"Oh, I wouldn’t miss it for the world.",Susan,4,1,752,7,6,16,"0:04:55,557","0:04:57,313",752_7_train
2455,9269,Pretty much.,Monica,0,0,926,11,6,2,"0:03:33,880","0:03:34,548",926_11_train
2456,9310,I know you botched that operation on purpose.,Joey/Drake,4,1,931,0,9,11,"00:22:41,360","00:22:43,694",931_0_train
2457,221,I cannot sleep in a public place.,Ross,0,0,21,1,1,4,"00:01:51,653","00:01:54,822",21_1_train
2458,611,"Okay, but the money’s good, plus you get to stare at Rachel as much as you want.",Gunther,0,0,64,13,6,12,"00:06:35,812","00:06:40,524",64_13_test
2459,713,"Well, maybe that’s because you’re closer to you. So you look bigger to you from where you are.",Joey,6,2,73,2,4,15,"00:11:36,946","00:11:40,990",73_2_test
2460,2185,Y’know what? It,Monica,0,0,222,1,4,18,"00:05:41,007","00:05:44,968",222_1_test
2461,673,Come on! Joe!,Ross and Chandler,4,1,70,17,9,12,"00:16:54,930","00:16:56,431",70_17_test
2462,7446,"Guys, rules are good! Rules help control the fun!  Ohhh!",Monica,4,1,743,5,5,5,"00:21:57,190","00:22:01,402",743_5_train
2463,1003,Just showing you my run-of-the-mill-slice-it-right-off third nipple.,Ross,0,0,100,5,3,23,"00:05:48,181","00:05:52,726",100_5_train
2464,9617,Oh great! That,Danny,6,2,956,4,5,10,"00:17:52,738","00:17:56,324",956_4_train
2465,3693,Not 700 exactly?,Chandler,1,1,367,6,6,6,"0:13:58,638","0:14:00,138",367_6_train
2466,6230,"Okay, okay. This can go on for a while.",Ross,0,0,625,6,7,17,"00:11:13,756","00:11:16,132",625_6_train
2467,3729,Oh. They don't.,Roger,1,1,372,7,1,13,"00:19:29,376","00:19:31,752",372_7_train
2468,7333,"No thanks, I’ve already seen one.",Phoebe,0,0,733,6,6,1,"00:20:50,832","00:20:52,708",733_6_train
2469,3019,Oh God.,Rachel,1,2,301,14,1,20,"00:20:34,358","00:20:35,858",301_14_train
2470,2182,"Yeah, and and, I'm just gonna pay for this with a check.",Rachel,0,0,221,3,1,2,"0:15:59,583","0:16:05,339",221_3_test
2471,9608,"So if I said yes, he would know I had nothing better to do than wait around for an invitation to his stupid party.",Rachel,6,2,955,2,5,7,"00:08:49,779","00:08:56,868",955_2_train
2472,2737,What?,Chandler,1,2,274,1,4,22,"0:10:12,111","0:10:12,583",274_1_train
2473,2980,How come it’s always us left in the field holding the ball?,Ross,4,1,298,2,3,9,"00:22:13,206","00:22:16,250",298_2_train
2474,1178,No you can’t.,Chandler,4,1,121,2,4,14,"0:12:21,283","0:12:23,221",121_2_train
2475,7551,"But if you have this new fangled dictionary that gets you made at me, then we have to, y'know, get you my original dictionary.",Chandler,0,0,757,3,5,3,"00:18:37,366","00:18:44,247",757_3_train
2476,624,"Hi Mom, it's Jill.",Jill,0,0,56,1,1,7,"00:02:23,309","00:02:24,643",56_1_train
2477,1014,"Aw, all right take this bed, you can make other friends.",Phoebe,4,1,108,9,3,7,"00:05:40,506","00:05:45,385",108_9_test
2478,529,"Oh, she’s gonna love that!",Monica,4,1,53,12,4,22,"00:06:51,202","00:06:52,786",53_12_test
2479,3213,And I suppose you used a ring designer for that.,Monica,4,1,319,17,3,23,"00:18:56,760","00:18:59,679",319_17_train
2480,1948,"That’s okay. All right, I’m gonna play song that’s really, really sad. It’s called Magician Box Mix Up.",Phoebe,4,1,194,1,3,10,"00:14:18,941","00:14:26,406",194_1_train
2481,7172,"Oh honey, I think I’m having one too!",Julie,1,1,713,1,8,23,"00:04:19,330","00:04:22,917",713_1_train
2482,332,Oh! Oop!,Phoebe,1,1,33,4,6,24,"00:04:11,459","00:04:13,085",33_4_train
2483,8774,Uh-huh.,Chandler,0,0,875,9,5,5,"00:08:05,151","00:08:06,651",875_9_train
2484,2254,Hey!,Chandler,0,0,223,3,5,4,"0:12:33,895","0:12:34,772",223_3_train
2485,3975,"Phoebe, woo!",Rachel,4,1,406,3,5,2,"0:15:48,408","0:15:48,775",406_3_train
2486,6166,In,Phoebe,0,0,617,9,7,10,"0:03:38,384","0:03:39,201",617_9_train
2487,764,Pheebs?,Rachel,0,0,71,0,1,4,"0:15:12,036","0:15:12,120",71_0_train
2488,4414,"Thank you, but I want to remove it Pheebs. I don’t want to make it savory.",Ross,0,0,450,1,3,23,"00:13:10,748","00:13:15,043",450_1_train
2489,783,"So, he’s just a nice guy. You really think this Mark doesn’t want anything in exchange for helping him?",Ross,4,1,81,0,3,11,"00:09:10,967","00:09:17,973",81_0_test
2490,2269,"Yeah, big fan.",Jake,0,0,224,3,7,22,"00:05:42,008","00:05:44,551",224_3_train
2491,4653,I don't think so!,Chandler,4,1,475,7,9,23,"00:31:42,025","00:31:44,109",475_7_train
2492,5521,Ross! Wait!,Elizabeth,3,2,555,0,6,24,"00:18:58,512","00:19:00,096",555_0_train
2493,10244,Thank you!,Ross,6,2,1018,10,8,8,"0:17:01,194","0:17:01,866",1018_10_train
2494,5757,"Oh, the duck seems to think that Monica got me garbage! Hmm, I wonder what I could get Monica that’s as good as garbage?",Chandler,6,2,583,1,6,10,"00:17:02,229","00:17:09,235",583_1_train
2495,6336,Hey! Did Chandler show up yet?,Joey,2,2,633,7,7,24,"0:08:19,624","0:08:21,926",633_7_train
2496,1776,And in the meantime you better let him drive. Does he have a license?,Policeman,0,0,179,15,7,22,"00:13:52,706","00:13:54,666",179_15_train
2497,4423,Right?,Monica,4,1,450,10,3,23,"00:14:08,347","00:14:11,432",450_10_train
2498,8175,Who?,Elizabeth,0,0,821,2,6,18,"00:09:56,554","00:09:57,596",821_2_train
2499,9719,I’m great! I’m great. I’ve got a great job at,Rachel,4,1,965,3,4,2,"00:13:01,030","00:13:10,663",965_3_train
2500,2605,"All right, I know! I know. Yeah, it’ll be okay.",Joey,4,1,257,0,8,12,"00:20:39,821","00:20:47,286",257_0_train
2501,6794,"Now, do you have any idea what you just said?",Ross,0,0,671,1,9,21,"00:16:01,669","00:16:05,213",671_1_train
2502,87,"Or, call an ambulance.",Chandler,6,2,6,21,8,22,"00:13:16,367","00:13:18,244",6_21_train
2503,7033,No! Don’t say that! Don’t say that!,Rachel,2,2,695,1,7,16,"00:09:18,182","00:09:20,517",695_1_train
2504,5277,"All right, look I was just trying to make a good first impression.",Ross,6,2,531,10,6,4,"00:20:43,867","00:20:47,703",531_10_train
2505,1501,Okay.,Ross,4,1,154,17,8,11,"00:03:05,727","00:03:08,353",154_17_test
2506,10298,There’s nothing wrong with a woman enjoying a little…erotica.,Rachel,0,0,1022,15,7,2,"00:08:11,115","00:08:15,952",1022_15_train
2507,5437,She could be you.,Rachel,0,0,546,10,1,21,"00:05:50,350","00:05:52,142",546_10_train
2508,1620,You mean with Casey.,Chandler,0,0,165,9,4,7,"00:14:50,931","00:14:51,671",165_9_train
2509,10131,"Wait, was this a-a small mediterranean guy with curiously intelligent good looks?",Monica,1,1,1009,9,1,4,"00:14:45,009","00:14:49,888",1009_9_train
2510,339,"Okay umm, Ross?",Rachel,0,0,34,0,5,23,"00:14:24,321","00:14:25,500",34_0_train
2511,2601,Get out!!,Rachel,6,2,256,13,8,22,"0:02:22,262","0:02:23,013",256_13_train
2512,389,"Eh, just a tad.",Rachel,0,0,32,5,8,22,"00:11:20,209","00:11:22,837",32_5_dev
2513,9394,"Now, the hydrosaurids have been unearthed in two main locations.",Ross,0,0,937,3,8,12,"00:21:20,696","00:21:26,909",937_3_train
2514,1535,"Oh God… Oh, he’s in there right now?",Rachel,1,2,156,5,8,2,"00:14:14,770","00:14:19,816",156_5_train
2515,765,What?! I didn't touch a guitar!,Joey,1,2,72,5,5,11,"00:11:20,471","00:11:22,555",72_5_dev
2516,290,"But,  you’ve got one more apology to make, all right, you’ve got to apologize to Mary-Angela.",Joey,0,0,24,3,3,11,"00:19:55,194","00:20:00,740",24_3_dev
2517,848,Chandler! He’s your father.  he should be at the wedding.,Monica,6,2,82,2,7,22,"00:03:17,155","00:03:20,032",82_2_train
2518,3513,"Well, if you wanna get a drink later we can.",Monica,0,0,350,5,3,6,"00:19:23,078","00:19:25,454",350_5_train
2519,2090,"Oh, and I can also speak a little French. Voulez-vous coucher avec moi ce soir?  Why? What did I say?",Monica,4,1,207,0,3,15,"00:14:12,393","00:14:21,192",207_0_train
2520,459,"Hey, Rach, how was work?",Monica,0,0,43,0,3,19,"00:21:33,917","00:21:37,211",43_0_train
2521,932,My drinking?,Rachel,0,0,94,0,4,9,"00:11:38,948","00:11:40,198",94_0_train
2522,4874,Hey!,Monica,6,2,498,6,7,5,"0:07:36,414","0:07:37,886",498_6_train
2523,7342,"Listen, drama critics they’re nothing but, but people who couldn’t make it as actors. You know what you should do?",Joey,4,1,734,2,3,22,"00:09:55,886","00:10:03,226",734_2_train
2524,1884,All right!,Joey,4,1,189,0,4,23,"00:06:39,982","00:06:41,817",189_0_test
2525,1197,Janice!,Chandler,1,1,124,9,4,15,"0:20:49,456","0:20:50,082",124_9_test
2526,5849,"All right, hold on!",Joey,0,0,592,4,5,12,"0:11:22,682","0:11:23,308",592_4_train
2527,126,"Oh, do you need a hug? You don’t have to bring me anything!",Phoebe,4,1,11,9,4,23,"00:03:44,849","00:03:51,563",11_9_train
2528,8547,"Oh, hello liar.",Phoebe,6,2,853,1,7,9,"00:14:29,201","00:14:31,035",853_1_train
2529,4955,"I need to talk to you, it’s pretty urgent. It’s about Monica and Chandler.",Phoebe,0,0,505,1,7,2,"00:01:59,619","00:02:03,122",505_1_train
2530,1774,Do you know what Pheebs?,Chandler,0,0,178,5,6,5,"00:05:54,645","00:05:55,687",178_5_test
2531,745,"Uh, listen, I just wanna thank you for this great opportunity.",Joey,4,1,68,1,1,6,"00:13:40,069","00:13:43,738",68_1_train
2532,10203,"No. But it’s okay, I’ll just put out pickles or something.",Carol,0,0,1016,6,3,17,"00:15:11,660","00:15:15,955",1016_6_train
2533,8598,The rule is when two actors are actually doing it off-stage all the sexual tension between them is gone.,Joey,0,0,858,6,4,13,"00:04:33,481","00:04:41,280",858_6_train
2534,3107,"Yeah, it’s for our catering business!",Phoebe,4,1,311,5,4,9,"00:00:24,149","00:00:25,774",311_5_train
2535,10328,String?,The Potential Roommate,0,0,1024,12,6,3,"00:21:30,831","00:21:32,999",1024_12_train
2536,9948,And the cream?,The Cooking Teacher,0,0,991,3,8,21,"0:13:10,415","0:13:11,333",991_3_train
2537,7287,What?,Ross,0,0,727,2,4,11,"00:02:36,781","00:02:37,823",727_2_train
2538,1384,I can't write!,Joey,6,2,140,11,5,10,"00:06:20,880","00:06:23,799",140_11_test
2539,6238,"Well sorry, that’s what I do on dates.",Ross,0,0,625,14,7,17,"00:11:44,787","00:11:48,665",625_14_train
2540,1976,"You gotta make sure that when Paolo walks out of there, the first guy Rachel sees is you, She's gotta know that you're everything he's not!",Joey,4,1,198,7,1,12,"00:17:26,462","00:17:32,842",198_7_test
2541,747,"See buddy, that's all you need, a bunch of toothless guys hitting each other with sticks.",Chandler,0,0,70,1,1,4,"00:12:23,743","00:12:27,370",70_1_dev
2542,2248,"I know.  Yeah, his name is Pat.",Joey,0,0,229,1,6,16,"00:02:34,612","00:02:39,741",229_1_test
2543,809,"Ah-ha, nowhere to run!",Ross,4,1,78,0,6,17,"00:21:08,850","00:21:11,811",78_0_train
2544,2464,"We couldn’t keep our eyes off each other all night and then every once and a while y’know, he’d kinda lean over and stroke my hair and touch my neck.",Phoebe,4,1,245,1,7,18,"00:06:51,202","00:06:59,292",245_1_train
2545,2385,"Now you do that, you’re on TV.",Chandler,0,0,235,9,6,10,"00:21:45,178","00:21:48,472",235_9_train
2546,7138,Oh whoa-whoa-whoa!,Phoebe,6,2,707,0,5,10,"00:16:32,282","00:16:33,324",707_0_train
2547,5571,Oh my god.,Monica,1,2,561,3,1,5,"0:18:06,126","0:18:06,968",561_3_train
2548,6066,Oh my God!  I'm your,Charlie,1,1,610,5,9,23,"00:30:56,271","00:30:59,106",610_5_train
2549,756,"No it’s not! You want it, you’re gonna have to win it!",Monica,6,2,77,3,3,9,"00:12:20,448","00:12:23,575",77_3_test
2550,4700,Hey!,Joey,0,0,478,3,6,24,"0:19:42,313","0:19:42,450",478_3_train
2551,336,"Oh, come on!",All,3,2,28,6,5,8,"0:04:23,780","0:04:24,782",28_6_dev
2552,1985,Ross!,Phoebe,1,1,198,4,6,25,"00:13:22,176","00:13:24,511",198_4_train
2553,722,Thanks!,Ross,4,1,68,10,6,21,"00:02:45,999","00:02:47,541",68_10_dev
2554,2460,"Ah, uh, I owe you a long overdue apology. I never should have broken up with you because you were overweight.",Chandler,0,0,242,4,7,6,"00:14:15,646","00:14:25,738",242_4_train
2555,1806,You had no relationship!!,Monica,6,2,182,4,5,10,"00:07:11,764","00:07:13,598",182_4_train
2556,315,"You know what, where he hugs you and kinda rolls you away and... Oh... my....God.",Janice,5,2,30,5,3,3,"00:17:15,659","00:17:27,045",30_5_test
2557,2019,Erin! Still here!,Joey,4,1,202,4,7,7,"0:05:58,275","0:05:59,131",202_4_test
2558,10440,"It's a money thing, we don't have any.",Stanley,3,2,1036,3,5,22,"00:19:27,666","00:19:30,001",1036_3_train
2559,690,Oo! You should have one of us do it!,Phoebe,4,1,64,5,7,16,"00:02:35,864","00:02:37,781",64_5_train
2560,9470,Would she?  You ate my candy bar!,Joey,6,2,944,1,7,1,"00:14:07,263","00:14:11,808",944_1_train
2561,1721,"Well, I did put a lot of thought in the tape.",Chandler,0,0,173,18,6,17,"00:13:14,335","00:13:17,545",173_18_test
2562,1671,Hey!,Phoebe,6,2,169,9,8,2,"0:12:09,985","0:12:11,371",169_9_test
2563,9978,What are you doing?,Ross,0,0,993,2,4,8,"00:06:02,528","00:06:03,570",993_2_train
2564,5551,"Oh, yeah. Had that dream.",All,0,0,559,1,1,1,"00:01:25,627","00:01:27,169",559_1_train
2565,4945,You can keep those pants by the way.,Rachel,0,0,504,5,8,9,"00:21:24,366","00:21:25,908",504_5_train
2566,8975,"Really? So, you're gonna stick with this 'it's all for her' thing?",Chandler,0,0,898,3,1,24,"00:18:32,236","00:18:34,862",898_3_train
2567,872,"This way I'm just y'know, the exotic, generous stranger.",Phoebe,4,1,95,7,5,15,"00:13:25,262","00:13:27,722",95_7_test
2568,1251,Are you under the sheet?,Phoebe,0,0,128,0,8,14,"0:07:28,160","0:07:29,202",128_0_train
2569,566,Let me tell you about this chick I scored with last night! Oh no wait a minute that was you!,Chandler,4,1,58,2,6,16,"00:14:33,873","00:14:41,379",58_2_test
2570,7693,Oh Drake.,Hope,4,1,772,8,6,15,"00:20:52,751","00:20:54,377",772_8_train
2571,618,No way are you cool enough to pull of Clint.,Joey,5,2,65,3,4,18,"00:17:30,466","00:17:33,551",65_3_test
2572,6713,Why? What happened to him?,Chandler,0,0,664,7,3,15,"00:17:06,859","00:17:08,985",664_7_train
2573,4608,"Oh, that’s very—Really very-very okay.",Rachel,0,0,469,0,8,23,"00:06:10,942","00:06:14,237",469_0_train
2574,691,I think it means he freaked out and left!,Ross,1,2,66,3,7,23,"00:14:56,020","00:15:01,065",66_3_dev
2575,1093,"Yes, you did!",Monica,1,1,104,12,5,8,"0:21:18,944","0:21:21,072",104_12_dev
2576,2862,"Look, you have not been out with a woman since Janice.",Joey,0,0,287,9,1,14,"0:02:52,255","0:02:54,717",287_9_train
2577,8964,"Okay, y'know what, I have to go have dinner with my son, can I trust that when you see Phoebe, you will tell her.",Ross,0,0,897,3,4,2,"00:11:35,695","00:11:38,613",897_3_train
2578,477,I'll see you later.,Jen,0,0,44,9,5,17,"0:13:55,084","0:13:56,046",44_9_dev
2579,1893,"Yes, I do.",Rachel,0,0,188,2,4,2,"0:09:39,891","0:09:40,887",188_2_train
2580,2893,I-I’m sorry?,Earl,3,2,290,0,6,7,"00:10:02,476","00:10:04,603",290_0_train
2581,1082,Joe?,Chandler,2,2,111,1,7,1,"0:09:17,848","0:09:18,810",111_1_train
2582,3105,"Okayyyyy, open up!",Phoebe,4,1,311,3,4,9,"00:00:11,511","00:00:13,303",311_3_train
2583,6549,God. I feel violated.,Rachel,5,2,652,0,1,6,"00:01:51,277","00:01:53,403",652_0_train
2584,4595,"Oh, look, wish me luck!",Rachel,4,1,467,0,1,1,"0:16:45,504","0:16:46,088",467_0_train
2585,5677,You miss your girlfriend?,Evil Bitch,0,0,572,14,8,23,"00:09:57,793","00:09:59,670",572_14_train
2586,329,It’s the big night! We wanted to wish you good luck!,Joey,4,1,33,1,6,24,"00:04:01,741","00:04:03,951",33_1_train
2587,995,Can we see her?,Joey,0,0,93,5,2,1,"00:15:24,173","00:15:25,298",93_5_dev
2588,7171,"Oh. Okay, just breathe.",Ross,0,0,713,0,8,23,"00:04:16,327","00:04:19,122",713_0_train
2589,2428,"So it said that by the year 2030, there'll be computers that can carry out the same number of functions as an actual human brain.",Ross,0,0,239,0,6,7,"00:21:07,724","00:21:15,564",239_0_train
2590,2530,"Well, it's technically not a zoo per se, it's more of an interactive wildlife experience.",Dr. Baldhara,0,0,252,1,1,21,"00:14:12,059","00:14:17,730",252_1_train
2591,7179,"See I-I wrote a book up there and instead of reading it people are-are-are well, rolling around in front of it.",Ross,6,2,714,5,7,7,"00:10:18,451","00:10:24,164",714_5_train
2592,7275,Uh-huh.,Phoebe,0,0,725,5,7,22,"0:16:08,342","0:16:08,968",725_5_train
2593,10124,Thank God. Food.,Rachel,4,1,1009,2,1,4,"00:14:05,094","00:14:07,011",1009_2_train
2594,666,Hey! How’s my pal Toby doing today?,Bob,4,1,62,1,8,5,"00:07:23,484","00:07:26,736",62_1_train
2595,9368,Hmm.,Monica,0,0,935,13,5,23,"00:17:16,744","00:17:18,369",935_13_train
2596,583,Flight’s in an hour. I-I gotta go.,Kate,3,2,56,4,3,22,"00:19:58,530","00:20:00,698",56_4_dev
2597,2466,How does that sound?,Mr. Kaplan,0,0,249,4,3,11,"0:04:20,385","0:04:21,147",249_4_test
2598,2011,That’s right!,Ross,4,1,200,8,6,23,"0:14:16,522","0:14:16,663",200_8_train
2599,2056,Waitressing?,Kiki,1,2,204,8,1,4,"00:07:56,476","00:07:58,143",204_8_train
2600,6709,"Oh come on, we just had this huge fight, all right, don’t I have to wait a while?",Ross,3,2,664,3,3,15,"00:16:49,425","00:16:52,635",664_3_train
2601,1344,"Wow, that feels so good to get off my chest!",Rachel,4,1,138,2,5,12,"0:12:00,511","0:12:02,388",138_2_train
2602,253,"I mean for, for all you know I could be a fashion..... monger.",Ross,0,0,24,6,3,14,"00:11:01,827","00:11:05,121",24_6_train
2603,6604,Oh May 15,Monica,0,0,657,6,7,17,"0:04:30,688","0:04:31,965",657_6_train
2604,397,"So, we did okay at the strip club, right?",Monica,0,0,41,0,4,14,"00:17:28,839","00:17:32,300",41_0_test
2605,5864,Oh God!,Robert,3,2,593,3,3,13,"0:17:50,152","0:17:51,534",593_3_train
2606,9712,Umm,Ross,0,0,964,14,5,5,"00:07:15,059","00:07:16,518",964_14_train
2607,8591,"Thanks guys!  I really appreciate this, y’know, but you don’t have to rub my butt.",Ross,4,1,857,11,5,1,"00:20:51,333","00:20:58,881",857_11_train
2608,5946,Yeah?,Ross,0,0,599,17,7,9,"00:05:44,427","00:05:46,678",599_17_train
2609,4105,"Pheebs, that’s great!",Rachel,4,1,420,1,4,10,"0:06:54,789","0:06:56,124",420_1_train
2610,2950,"Hello, Susan.  Good shake. Good shake. So, uh, we're just waiting for...?",Ross,6,2,296,5,1,2,"00:14:49,471","00:14:56,728",296_5_train
2611,568,"Yeah, see.. you took mine. Chandler, what about you?",Ross,0,0,54,3,1,4,"00:00:17,100","00:00:22,438",54_3_dev
2612,484,But it's dark out.,Joey,0,0,49,4,5,5,"00:00:30,030","00:00:31,405",49_4_test
2613,7219,Ahhh..,Joey,6,2,720,2,5,7,"00:09:25,523","00:09:32,320",720_2_train
2614,1879,"Wait, just a second.",Gary,0,0,186,4,5,21,"0:20:12,980","0:20:13,729",186_4_train
2615,7763,The ride broke down.,Ross,0,0,775,11,1,7,"00:06:19,545","00:06:20,879",775_11_train
2616,9468,"No, just a Friday night.",Monica,0,0,943,5,7,3,"0:13:42,113","0:13:44,177",943_5_train
2617,7620,I am not high maintenance!,Monica,6,2,766,2,6,12,"0:13:30,059","0:13:31,311",766_2_train
2618,6323,Well do you love him?,Monica,0,0,632,12,9,1,"00:15:05,821","00:15:07,071",632_12_train
2619,1778,Can he handle the stick?,Policeman,0,0,179,17,7,22,"0:13:55,086","0:13:57,310",179_17_train
2620,768,Thank you.,Monica,0,0,72,8,5,11,"00:11:32,066","00:11:33,525",72_8_dev
2621,8436,"And-and you don’t need, you don’t need this custom-made, empire-waisted, duchess, satin gown; you can wear off the rack.",Rachel,0,0,843,14,7,2,"00:13:21,050","00:13:29,432",843_14_train
2622,2664,"Y'know, it's hand, hand, head, head,  up, pas de bouree, pas de bouree, big turn here, grand sissone, sissone, sissone, slide back, step, step, step, and jazz hands!",Director,0,0,267,7,3,12,"00:15:27,051","00:15:31,471",267_7_test
2623,1777,Yeah!,Rachel,0,0,179,16,7,22,"0:13:54,834","0:13:55,086",179_16_train
2624,1733,Is that Mark?,Ross,0,0,174,11,3,15,"00:18:11,006","00:18:12,090",174_11_test
2625,1158,Huh?,Monica,0,0,111,1,3,25,"00:11:56,298","00:11:57,340",111_1_dev
2626,363,"Oh yeah, you’re solid. Yeah, you’re just no me.",Phoebe,0,0,30,11,6,20,"00:00:38,246","00:00:40,789",30_11_dev
2627,5601,What if I asked?,Monica,0,0,563,2,4,11,"00:21:35,502","00:21:36,627",563_2_train
2628,8224,"Wow, I have the spirit of an old Indian women living in mine.",Phoebe,0,0,827,0,3,16,"00:04:49,080","00:04:52,666",827_0_train
2629,153,Oh yeah? Well maybe you and I should take a walk through a bad neighborhood.,Gary,4,1,15,1,5,20,"00:13:18,576","00:13:21,341",15_1_test
2630,956,"Ok, Paulo, why don't you just go get dressed, and then you be on your way, ok, bye-bye.",Rachel,4,1,90,0,2,1,"00:11:02,536","00:11:08,208",90_0_dev
2631,554,"That’s it? Well I saw that! Ohh-ohh-oh, thank you.",Rachel,4,1,56,8,8,3,"00:20:48,372","00:21:01,175",56_8_test
2632,9838,"My God, what were you thinking about?",Friend No. 1,1,2,978,8,3,6,"00:22:23,884","00:22:26,761",978_8_train
2633,4708,Why?! To celebrate your relationship! To solidify your commitment! To declare your love for one another to the world!,Monica,6,2,478,10,6,24,"00:20:11,877","00:20:19,133",478_10_train
2634,870,"Oh, wait, Joshua! Joshua!   Yeah, well, that oughta do it.",Rachel,3,2,84,6,4,20,"00:21:22,823","00:21:33,165",84_6_train
2635,9082,Oh.,Rachel,0,0,908,1,7,12,"0:02:27,939","0:02:28,837",908_1_train
2636,10429,Oh! It’s you.  Hi.,Rachel,1,1,1034,2,4,20,"00:04:24,597","00:04:26,390",1034_2_train
2637,329,Ooooohh!,Joey and Chandler,1,2,32,0,1,12,"00:10:59,992","00:11:01,034",32_0_train
2638,1463,"Okay! So, we’ll just stay married.",Rachel,4,1,151,0,6,1,"00:12:18,404","00:12:21,156",151_0_train
2639,5176,Yes.,Phoebe,0,0,524,7,3,10,"0:07:43,047","0:07:43,689",524_7_train
2640,3632,Susan Sarandon.,Ross,0,0,361,8,3,5,"00:08:41,145","00:08:42,854",361_8_train
2641,8991,"Not him, you don’t!",Phoebe,1,1,900,12,3,15,"00:04:48,204","00:04:49,454",900_12_train
2642,6629,"Oh, yeah. Yeah. Let her dangle.",Joey and Ross,0,0,658,9,1,20,"00:02:04,207","00:02:05,791",658_9_train
2643,1787,Whoo-hoo!,Phoebe,4,1,180,4,1,20,"0:22:18,420","0:22:18,754",180_4_test
2644,3301,Then keep running.,Phoebe,0,0,329,10,6,6,"00:13:38,567","00:13:39,692",329_10_train
2645,1020,"So? Congratulations you two, I didn’t even know you got married.",Janice,1,1,104,0,8,23,"00:21:10,757","00:21:14,761",104_0_train
2646,5110,Happy?! Is that what I’m supposed to be Vic? Happy?,Kate,6,2,518,0,3,19,"00:19:15,821","00:19:19,866",518_0_train
2647,4661,... and...?,Phoebe,0,0,475,15,9,23,"0:32:03,438","0:32:04,409",475_15_train
2648,2160,"No. It was painful. Oh my God , they should call it Pain-zine, now with a little wax.",Monica,5,2,212,5,3,16,"00:07:44,380","00:07:50,010",212_5_train
2649,2120,"We share a wall! So either he’s great in bed, or she just likes to agree with him a lot.",Chandler,0,0,213,4,4,11,"00:06:52,578","00:07:00,627",213_4_test
2650,1079,Hey.,Joey,0,0,110,4,7,3,"00:08:17,121","00:08:18,163",110_4_train
2651,3074,Is that why in junior high you were the only one that hung out with that Ukrainian kid?,Ross,0,0,307,4,4,17,"00:04:25,098","00:04:29,601",307_4_train
2652,8406,"All right, first name on the speed dial is mom.",Rachel,0,0,842,3,7,15,"00:06:19,545","00:06:25,884",842_3_train
2653,9668,"All right, let's go Pheebs.",Joey,0,0,961,13,5,12,"00:06:36,062","00:06:37,687",961_13_train
2654,6162,"Yeah, oh, ""Your mom probably won't kill herself,"" y’know?",Phoebe,6,2,617,6,7,10,"00:03:26,456","00:03:32,711",617_6_train
2655,1597,That-that he’s a-a complex fellow who’s unlikely to take a wife!,Monica,6,2,163,8,6,25,"00:07:11,806","00:07:15,308",163_8_train
2656,7503,"Ten, even twenty minutes if you need it.",Richard,0,0,750,2,6,25,"00:14:58,439","00:15:00,398",750_2_train
2657,677,"Hey! Guys, this is Tabatha .  I'll see you tomorrow.",Molly,0,0,70,20,9,12,"00:17:07,526","00:17:16,993",70_20_test
2658,2405,"And y'know what, I get excited about stupid stuff, like when I my",Monica,0,0,237,3,3,12,"00:16:23,983","00:16:29,070",237_3_train
2659,19,Ok!,Joey,0,0,1,4,9,23,"00:36:52,376","00:36:53,543",1_4_train
2660,7319,"Geez, sounds like you should be going on this date!",Joey,1,1,730,9,9,21,"00:11:57,591","00:12:00,218",730_9_train
2661,1085,Oh my—Oh good God!,Monica,1,2,113,14,5,21,"00:12:22,366","00:12:24,409",113_14_test
2662,4355,How do you expect me to stay calm?!,Dr. Green,6,2,445,14,8,8,"00:08:46,651","00:08:48,777",445_14_train
