884,5385,I love that idea!,Carol,4,1,541,19,6,15,"0:15:08,658","0:15:10,008",541_19_train
885,2279,"Yeah, well it came to about $112, but what the hell, just call it an even 110?",Ross,0,0,225,7,3,17,"00:22:13,081","00:22:20,629",225_7_train
886,5813,I don’t need you guys to care about me!,Earl,6,2,589,7,7,13,"00:19:25,414","00:19:27,874",589_7_train
887,6094,"That’s the day you’re gonna die? See—darnit, I’ve got shuffleboard that day.",Ross,0,0,613,0,7,3,"00:18:05,000","00:18:10,338",613_0_train
888,565,Hey!,Monica,4,1,58,1,6,16,"0:14:31,662","0:14:32,984",58_1_test
889,3380,Me! On my computer.,Chandler,4,1,336,21,3,10,"00:13:37,233","00:13:38,650",336_21_train
890,218,"""Y’know, harm can it do if you go and put your name down?""",Monica,0,0,18,11,6,22,"00:16:41,375","00:16:44,669",18_11_dev
891,2168,Oh! I remember laughing! I laughed a lot.,Rachel,4,1,217,8,6,1,"00:03:16,905","00:03:21,283",217_8_test
892,2812,"Well, when Jake did it I saw that…he was wearing women’s underwear!",Joey,1,2,281,4,7,22,"00:08:05,860","00:08:11,823",281_4_train
893,1377,"Hi, Julie!",All,4,1,142,1,2,5,"00:03:14,360","00:03:16,820",142_1_train
894,512,She is?,Joey,1,2,52,7,8,7,"00:10:42,141","00:10:44,142",52_7_test
895,1304,Yeah. You okay?,Joey,0,0,131,2,3,14,"00:21:24,700","00:21:26,200",131_2_train
896,8422,I can’t believe this. Do you think that your parents could help pay for it?,Monica,1,2,843,0,7,2,"00:12:28,164","00:12:30,999",843_0_train
897,2679,"Oh, DAMN IT!",Chandler,6,2,268,10,9,22,"00:03:29,292","00:03:31,335",268_10_test
898,120,These,Phoebe,0,0,11,9,5,19,"0:05:57,065","0:05:57,211",11_9_dev
899,1027,Hey!,Phoebe,4,1,97,1,3,20,"0:04:06,204","0:04:06,706",97_1_dev
900,6400,"Ok, got the vent open.",Ross,0,0,639,0,1,23,"00:16:18,268","00:16:20,228",639_0_train
901,495,"No, no he’s not.",Ross,0,0,46,3,3,8,"00:02:41,119","00:02:42,452",46_3_dev
902,885,Excuse me.,Joey,0,0,82,11,6,21,"00:10:17,825","00:10:20,118",82_11_dev
903,1406,"Yeah, toast, oatmeal... nothing that spatters.",Joey,0,0,145,17,1,20,"00:06:18,544","00:06:21,713",145_17_train
904,686,"Well, I, umm",Rachel,2,2,65,9,4,9,"00:04:50,873","00:04:51,873",65_9_dev
905,267,Really?,Joey,1,1,25,11,4,4,"00:21:21,029","00:21:22,113",25_11_train
906,7283,"Well, maybe after we get reacquainted uh, you can do me.",Cassie,4,1,726,6,7,19,"00:13:18,297","00:13:21,424",726_6_train
907,823,"Oh what are you kidding? She’s gorgeous, it’s all Rachel.",Ross,4,1,77,3,8,24,"00:17:23,322","00:17:27,075",77_3_dev
908,7304,"But there are no boles, she’s smooth!",Chandler,0,0,728,8,4,7,"0:00:38,913","0:00:40,832",728_8_train
909,9670,That was amazing.,Chandler,4,1,962,0,8,24,"0:21:27,733","0:21:28,735",962_0_train
910,650,Way to go!,Doug,4,1,59,6,3,24,"0:21:09,780","0:21:10,558",59_6_train
911,8265,"All right, I’ll leave.",Chandler,3,2,830,6,3,7,"00:22:31,516","00:22:33,559",830_6_train
912,5069,Phoebe!,Rachel,6,2,512,14,7,15,"00:10:18,075","00:10:20,076",512_14_train
913,9862,Well that’s a full cup!,Chandler,1,1,982,9,6,6,"0:11:58,426","0:12:00,418",982_9_train
914,2157,Grasp one of the linen strips by its ‘easy grab tab’ and pull it off in one quick pain free motion.,Phoebe,0,0,212,2,3,16,"00:07:31,367","00:07:37,706",212_2_train
915,2032,Yeah!,Rachel,4,1,203,9,3,25,"0:13:59,145","0:14:00,180",203_9_test
916,1404,"Will you grow up? I'm not talking about sexy stuff, but, like, when I'm cooking naked.",Joey,5,2,145,15,1,20,"00:06:08,993","00:06:14,664",145_15_train
917,8030,Okay.,Chandler,0,0,809,12,6,6,"00:08:45,608","00:08:47,484",809_12_train
918,6551,"Ross, ten o'clock.",Chandler,0,0,652,2,1,6,"00:02:00,120","00:02:01,161",652_2_train
919,2495,"Look, Ross, you have what you want, you’re back with Rachel.",Chandler,0,0,252,8,4,1,"00:12:08,102","00:12:11,187",252_8_test
920,5954,"Yeah, drop it! Drop the towel! Please drop the——wowww.",All,4,1,601,5,1,4,"00:19:49,688","00:20:01,991",601_5_train
921,7393,I can’t believe mom and dad are selling the house!,Monica,6,2,738,6,7,13,"00:02:14,968","00:02:16,969",738_6_train
922,2590,Give me your hands.  Strings. Gimme it!  Pick. Do you want to learn to play guitar?,Phoebe,6,2,260,8,5,11,"00:07:10,138","00:07:17,060",260_8_test
923,1066,A little.   Now you’re talking.,Phoebe,0,0,112,17,8,17,"00:18:43,914","00:18:50,128",112_17_test
924,1303,Remoray. It’s Portuguese. We need that information. I’m a doctor.,Joey,0,0,132,8,8,23,"00:14:38,115","00:14:43,746",132_8_test
925,5884,Well you did pull his hair.,Chandler,0,0,595,1,6,1,"00:14:01,298","00:14:03,299",595_1_train
926,4918,So does it really hurt as bad as they say?,Rachel,4,1,502,2,5,3,"00:21:43,051","00:21:52,685",502_2_train
927,8708,"And pretty soon you'll be like,  'Hhiii,' and, and, and, 'I can't go, Rachel and Mark might be there.'",Joey,5,2,869,15,3,12,"00:13:23,636","00:13:34,229",869_15_train
928,5935,"Yeah, and they’ve been coming by all day. They love it!",Phoebe,4,1,599,6,7,9,"00:04:58,006","00:05:00,132",599_6_train
929,1158,"No, I’m not mocking you,  or you beautiful guest room.",Chandler,0,0,120,18,6,3,"00:05:14,230","00:05:16,690",120_18_test
930,4278,We’re still on this side of the door.,Richard’s Date,0,0,438,8,3,13,"0:19:07,229","0:19:08,781",438_8_train
931,4436,So… It’s really just about the math.,Phoebe,0,0,450,23,3,23,"00:15:09,742","00:15:15,371",450_23_train
932,1917,This is going in your book?,Chandler,1,2,192,7,6,21,"0:08:08,863","0:08:10,156",192_7_test
933,2305,"Oh, anyway, they say, if we want, we can see it tonight.",Phoebe,0,0,233,8,7,10,"00:11:39,281","00:11:41,41",233_8_test
934,8809,"Goin’ out, huh? Wow! Wow!  So things didn’t work out with Kathy, huh? Bummer.",Chandler,1,1,884,5,4,7,"00:01:52,320","00:02:00,410",884_5_train
935,6913,Hey guys!,Joey,0,0,679,6,6,21,"0:00:31,364","0:00:31,796",679_6_train
936,7830,Gettin’ all dressed up and going to a fancy restaurant.,Rachel,0,0,791,10,8,12,"0:02:33,737","0:02:36,343",791_10_train
937,2445,"He's totally ok with seeing you!"".",Phoebe,6,2,241,3,9,22,"0:01:31,696","0:01:31,852",241_3_train
938,1157,Are you mocking me?,Monica,6,2,120,17,6,3,"00:05:12,937","00:05:14,062",120_17_test
939,862,"No, no, he hasn't been around.",Phoebe,0,0,80,2,1,10,"00:12:08,227","00:12:09,519",80_2_dev
940,5669,Are you looking at her?!,Evil Bitch,6,2,572,6,8,23,"0:09:28,723","0:09:29,905",572_6_train
941,114,"I mean, enough of the silliness!",Ross,6,2,12,3,6,3,"0:12:55,691","0:12:58,073",12_3_test
942,1821,Ta-da.,Phoebe,4,1,183,2,2,4,"0:09:55,315","0:09:56,264",183_2_train
943,2453,"Anyway, look, I don’t know about you and your jackets and your separate tables, but Ross is one of my best friends, and if I save him a seat, I’m telling you, he",Joey,0,0,246,11,4,11,"00:11:22,348","00:11:31,147",246_11_test
944,10001,This is our wedding I’m talking about.,Emily,6,2,996,11,4,23,"00:11:35,236","00:11:37,779",996_11_train
945,1043,Yeah. No. No...,Chandler,6,2,111,10,1,11,"00:20:03,785","00:20:06,495",111_10_test
946,10301,"Well, I feel like a snack!",Chandler,4,1,1023,0,7,15,"00:14:33,622","00:14:35,790",1023_0_train
947,2278,"You’re a genius, Ross.",Carol,4,1,225,6,3,17,"00:22:11,705","00:22:12,830",225_6_train
948,6815,You just finished?,Rachel,1,2,672,3,4,1,"0:07:24,235","0:07:25,457",672_3_train
949,925,Who am I gonna meet in a blackout?,Monica,6,2,98,5,1,7,"00:01:56,074","00:01:57,825",98_5_test
950,237,"Breathe, breathe, breathe.",Nurse,0,0,22,3,1,23,"00:09:09,882","00:09:13,510",22_3_train
951,2729,"Hey! So Chandler, wanna go to the coffeehouse?",Phoebe,4,1,273,13,6,23,"0:00:36,494","0:00:39,122",273_13_train
952,6997,Shhh!,Monica,0,0,689,3,4,2,"0:01:42,151","0:01:42,404",689_3_train
953,2158,Yeah.,Ross,0,0,216,2,4,19,"0:21:15,441","0:21:16,599",216_2_test
954,9146,I'm intrigued.,Chandler,0,0,913,9,5,10,"00:08:55,159","00:08:56,326",913_9_train
955,9085,"Come here, check this out!",Joey,1,1,908,4,7,12,"0:02:33,903","0:02:34,925",908_4_train
956,2350,Well?,Monica,1,2,232,9,1,23,"0:05:38,761","0:05:40,690",232_9_train
957,6587,Wow!,Elizabeth,1,1,655,6,6,18,"00:20:40,447","00:20:41,906",655_6_train
958,7097,How much did ever really win before?,Monica,0,0,702,2,7,22,"0:07:50,178","0:07:52,330",702_2_train
959,9248,Chandler.,Woman,0,0,925,0,1,15,"00:01:24,834","00:01:26,752",925_0_train
960,2723,Yeah! You wanna come?,Chandler,4,1,274,3,3,15,"0:01:37,680","0:01:38,765",274_3_test
961,293,You’ve got it.,Chandler,0,0,24,6,3,11,"0:20:02,931","0:20:03,875",24_6_dev
962,990,Then why are you smoking?,Monica,5,2,106,2,3,17,"00:14:39,712","00:14:41,170",106_2_test
963,760,You gotta take the canoe!,Tony,6,2,70,5,4,2,"00:10:35,885","00:10:37,260",70_5_train
964,1605,What is it?!,Monica,1,2,165,2,4,12,"00:21:27,911","00:21:29,370",165_2_test
965,2507,"All right, you’re telling me you can eat an entire turkey in just one sitting?",Monica,0,0,249,8,8,9,"00:02:35,697","00:02:39,616",249_8_train
966,9973,"Okay, don't you think, maybe, though, it's just that he's so perceptive that it freaks you out?",Phoebe,0,0,992,13,1,13,"00:16:22,231","00:16:27,443",992_13_train
967,3359,"....and 12, 22, 18, four...  What?",Ross,1,1,336,0,3,10,"00:11:55,840","00:12:07,000",336_0_train
968,7243,No! I would never do that! You-you're like my brother!,Joey,3,2,722,6,5,20,"00:15:42,441","00:15:47,028",722_6_train
969,3547,"I miss Janice though.  ""Hello, Chandler Bing.""",Phoebe,0,0,354,6,2,3,"00:02:48,459","00:02:52,671",354_6_train
970,132,"But I don't. Me, Phoebe.",Phoebe,0,0,13,1,1,13,"00:19:50,022","00:19:52,648",13_1_test
971,2245,"Gunther, I quit.",Rachel,3,2,228,11,3,10,"00:11:44,120","00:11:45,328",228_11_test
972,340,"I'm-I'm really warm, so I'm going to be taking off my sweater.",Rachel,0,0,34,1,5,23,"00:14:24,321","00:14:28,992",34_1_train
973,1723,Thank you. Thank you so much!,Rachel,4,1,175,2,1,9,"00:07:58,394","00:08:00,896",175_2_train
974,7825,"Uh, Paul’s Café. They got great food and it’s really romantic.",Rachel,0,0,791,5,8,12,"00:02:10,588","00:02:15,259",791_5_train
975,10232,Remember Phil Huntley?,Phoebe,0,0,1017,12,5,6,"0:13:17,546","0:13:18,598",1017_12_train
976,9098,Wow! This place is incredible!  Sting’s pen…that he gave to Phoebe.  Come on! Secret passageway!,Phoebe,4,1,909,0,8,10,"00:15:11,827","00:15:22,629",909_0_train
977,598,Is my baby gonna have his Uncle Joey?,Dina,3,2,54,16,8,10,"00:20:32,105","00:20:34,523",54_16_train
978,9619,"Do-do you, do you have brothers?",Danny,0,0,956,5,5,10,"00:18:01,830","00:18:05,917",956_5_train
979,6054,Thanks.,Phoebe,0,0,608,4,1,7,"0:20:59,526","0:21:00,808",608_4_train
980,2383,"1, 2, 3, 4, 5, 6, 7, 8",Monica and Ross,0,0,235,7,6,10,"00:21:36,586","00:21:41,090",235_7_train
981,2253,Hi Chandler.,Monica,0,0,223,2,5,4,"0:12:33,043","0:12:33,895",223_2_train
982,815,"No, but he told me, he thinks your a fox.",Monica,0,0,87,1,3,5,"00:02:35,238","00:02:38,448",87_1_test
983,4005,I can't believe you'd rather go out with him than me.,Ross,1,1,410,1,1,24,"00:19:02,391","00:19:06,602",410_1_train
984,8530,"Okay. Yeah. Listen would you uh, would you like to have dinner with me tonight?",Joey,0,0,851,15,7,17,"00:06:03,363","00:06:09,701",851_15_train
985,2678,"So, keep having sex on a regular basis.",Doctor Connelly,0,0,268,9,9,22,"0:03:27,262","0:03:29,180",268_9_test
986,10398,Is this about me taking your watch?,Chloe,3,2,1030,1,3,16,"00:08:20,625","00:08:22,709",1030_1_train
987,4578,Man. Can you believe he's only had sex with one woman?,Joey,1,1,466,0,1,4,"00:19:56,904","00:20:01,991",466_0_train
988,10235,Oh no,Rachel,2,2,1018,1,8,8,"0:16:25,609","0:16:28,161",1018_1_train
989,5124,"Don't worry, Chandler, it's not a globe of the United States.",Joey,0,0,520,0,7,8,"00:04:07,288","00:04:10,249",520_0_train
990,5525,"Okay, break-up’s still on!",Ross,6,2,555,4,6,24,"00:19:13,235","00:19:17,780",555_4_train
991,4978,"It’s just changed, everything.",Rachel,3,2,506,8,3,16,"00:21:27,035","00:21:29,662",506_8_train
992,9563,I'm gonna go kiss Ben goodnight.,Ross,4,1,950,13,5,11,"00:19:00,556","00:19:02,723",950_13_train
993,1247,No-no!,Chandler,2,2,127,1,4,20,"0:08:12,533","0:08:13,555",127_1_train
994,2234,Remind me to review with you which pot is decaf and which is regular.,Gunther,0,0,228,0,3,10,"00:11:07,958","00:11:12,170",228_0_test
995,8381,Right here!,Chandler,3,2,841,6,6,22,"0:20:15,131","0:20:15,757",841_6_train
996,9795,Bye-bye Julie.,Rachel,0,0,975,0,2,4,"00:06:57,583","00:07:00,629",975_0_train
997,947,"Sophie, get in here!",Joanna,4,1,94,15,4,9,"0:12:21,491","0:12:23,063",94_15_train
998,1793,It’s you. This is yours.,Janice,0,0,180,12,8,24,"00:03:15,516","00:03:19,604",180_12_train
999,917,"And somewhere along the way, one of them is gonna realise what they’ve done and they’re call the whole thing off.",Rachel,0,0,89,15,4,20,"00:10:03,811","00:10:08,148",89_15_train
1000,9,Good to know.,Chandler,0,0,0,8,8,21,"00:16:59,477","00:17:00,478",0_8_train
1001,9405,"Oh hi, Mrs. Loreo, is Jennifer there?",Joey,1,1,938,7,3,20,"00:22:25,844","00:22:28,596",938_7_train
1002,9863,Damn! I am good at Cups!,Joey,4,1,982,10,6,6,"00:12:02,138","00:12:04,556",982_10_train
1003,5874,Please!,Joey,3,2,594,2,7,4,"0:18:43,248","0:18:43,599",594_2_train
1004,2014,"Sometimes I get in here just to get away from it! Hey, a nickel!!",Joey,6,2,201,11,4,2,"00:14:21,694","00:14:28,950",201_11_test
1005,984,"The wedding is off, sloppy and immature!",Monica,6,2,99,7,7,19,"00:05:46,304","00:05:48,972",99_7_train
1006,5495,Yeah!,Ross,4,1,553,8,6,10,"00:08:57,286","00:08:58,328",553_8_train
1007,2481,"Oh good, you’re here. Yeah, and I was worried that it was going to be uncomfortable.",Mona,3,2,246,1,8,8,"00:17:21,582","00:17:26,377",246_1_train
1008,4938,It's a four.,Chandler,0,0,503,14,5,24,"00:12:45,514","00:12:47,223",503_14_train
1009,8146,"Oh, Nancy Thompson from Phoebe’s old massage place is getting fired.",Monica,0,0,819,16,7,4,"00:06:54,664","00:06:57,916",819_16_train
1010,6143,"Well, I-I could live without it.",Rachel,0,0,615,15,1,3,"00:15:01,984","00:15:05,528",615_15_train
1011,4525,"You’ve have lipstick right here . That’s okay, it’s mine, we just kissed.",Phoebe,0,0,461,3,3,13,"00:06:18,127","00:06:23,840",461_3_train
1012,2589,"Uh sweetie, maybe you’d be more comfortable here?",Ross,0,0,256,1,8,22,"00:01:14,604","00:01:19,025",256_1_train
1013,5229,"Ohh! And I’m one of them!! Wow! Oh, I just cannot believe this! I mean, Joey Tribbiani!",Rachel,1,1,528,3,6,15,"00:17:20,456","00:17:29,464",528_3_train
1014,10029,Would you look at this dump? He hated us. This is his final revenge!,Monica,5,2,1000,0,2,3,"00:06:45,780","00:06:49,783",1000_0_train
1015,2333,"What?  Sophie, does she have ten minutes?",Ross,0,0,231,8,3,15,"0:10:38,304","0:10:39,889",231_8_train
1016,1236,I,Rachel,0,0,126,3,4,19,"00:00:44,377","00:00:46,420",126_3_train
1017,1915,Why would the little girl creep you out?,Monica,6,2,192,5,6,21,"00:08:03,399","00:08:06,151",192_5_test
1018,3207,Okay.,Monica,0,0,319,11,3,23,"00:18:26,063","00:18:27,563",319_11_train
1019,1042,Are we okay now?,Mrs. Bing,2,2,111,9,1,11,"00:20:00,699","00:20:03,034",111_9_test
1020,2588,"That’s right, still no baby!  Come on people! Please make some room!",Rachel,3,2,256,0,8,22,"00:01:08,890","00:01:14,437",256_0_train
1021,6401,"Hi, I'm Ben. I'm hospital worker Ben. It's Ben... to the rescue!",Phoebe,4,1,639,1,1,23,"00:16:20,396","00:16:26,359",639_1_train
1022,9173,Ah!,Ross,1,1,916,8,8,11,"00:12:55,691","00:12:57,233",916_8_train
1023,2116,"No, I’m afraid I won’t be able to make love as well as him.",Chandler,6,2,213,0,4,11,"00:06:38,856","00:06:41,983",213_0_test
1024,1949,"Okay sir, um-mm, let see if I got this right.",Rachel,0,0,195,0,3,5,"00:18:29,691","00:18:31,859",195_0_train
1025,7598,"Okay, buddy-boy. Here it is. You hide my clothes, I'm wearing everything you own.",Joey,0,0,762,0,3,2,"00:17:10,571","00:17:17,326",762_0_train
1026,2430,"Sure, your dresser is missing but this she notices.",Ross,6,2,244,15,3,6,"00:03:23,077","00:03:25,871",244_15_test
1027,1137,I did.  But it came at a price.,Chandler,0,0,119,4,8,12,"00:16:56,181","00:16:58,641",119_4_test
1028,10171,Shh!,Phoebe,6,2,1012,5,5,3,"0:08:24,253","0:08:24,712",1012_5_train
1029,4,You’re a genius!,Chandler,4,1,1,1,4,4,"00:12:32,334","00:12:33,960",1_1_dev
1030,9222,You can?,Rachel,1,1,922,5,4,23,"0:12:25,870","0:12:26,011",922_5_train
1031,1149,"Yes, yes I do.",Phoebe,0,0,110,4,6,11,"00:07:03,589","00:07:05,757",110_4_dev
1032,2249,Pat the dog. Oh! Oh! I get it!!,Rachel,4,1,229,2,6,16,"00:02:36,656","00:02:43,370",229_2_test
1033,188,"I’m sorry. Ugh, Pheebs, you were, you were right about her. Y’know, she",Ross,3,2,16,14,7,5,"00:20:40,906","00:20:47,203",16_14_dev
1034,5062,Yeah!,Phoebe,4,1,512,7,7,15,"0:09:52,925","0:09:53,601",512_7_train
1035,850,Well what are you gonna do when he finds out he wasn’t even asked?!,Monica,3,2,82,4,7,22,"00:03:24,370","00:03:26,914",82_4_train
1036,4854,Okay!,Phoebe,0,0,496,4,3,17,"00:13:57,545","00:13:58,670",496_4_train
1037,1529,Okay.,Mona,0,0,155,12,8,5,"0:21:09,101","0:21:10,791",155_12_train
1038,10464,I broke up with her.,Chandler,0,0,1038,3,2,3,"00:00:08,341","00:00:09,341",1038_3_train
1039,9723,"That’s right, I love you! And-and I’m gonna play with you all the time.",Ross,4,1,966,0,8,10,"00:01:47,565","00:01:55,030",966_0_train
1040,10219,"Yeah, you’re right.",Ross,0,0,1016,21,3,17,"00:16:16,642","00:16:17,892",1016_21_train
1041,8742,Hi Joey.,Phoebe,0,0,873,1,5,4,"00:16:24,108","00:16:25,149",873_1_train
1042,620,"Umm, Gene.",Phoebe,0,0,65,5,4,18,"0:17:35,861","0:17:36,112",65_5_test
1043,4570,That’s why it’s so funny.,Rachel,0,0,464,19,7,14,"00:11:55,631","00:12:00,135",464_19_train
1044,1172,Correct. Rachel claims,Ross,0,0,120,12,4,12,"00:13:44,365","00:13:46,783",120_12_train
1045,1943,"I..., a jingle? No, no-no-no, no.",Phoebe,0,0,193,4,3,14,"00:14:03,092","00:14:05,343",193_4_train
1046,9145,"All right! But uh, listen, what do you say we crank it up a notch?",Joey,4,1,913,8,5,10,"00:08:47,985","00:08:54,991",913_8_train
1047,584,"Yeah, but what if it's not? What if there    is a reason why we can't have a baby?",Chandler,2,2,60,0,9,21,"00:18:12,091","00:18:16,928",60_0_test
1048,7476,Whoa!,Joey,1,1,747,3,7,18,"00:08:06,986","00:08:08,069",747_3_train
1049,357,Thank you Ross.,Phoebe,4,1,35,4,7,9,"0:21:30,342","0:21:31,300",35_4_train
1050,4332,"Um, Rachel I’m really sorry.  That’s okay, do you wanna get back together?  Yeah, okay.  Did anyone else hear that?!",Phoebe,1,1,443,7,3,17,"00:02:09,754","00:02:17,886",443_7_train
1051,7606,"Hi, listen, I’m sorry about before.",Chandler,3,2,763,2,6,3,"0:09:26,107","0:09:27,984",763_2_train
1052,5259,"And I’m very sorry, but I don’t know where your Father is, and that’s the truth.",Phoebe Sr,3,2,530,16,3,25,"00:19:49,605","00:19:55,735",530_16_train
1053,5643,"You wanna go right now? 'Cause I'll take you right now, buddy! You wanna go?",Monica,6,2,570,0,5,10,"00:13:24,386","00:13:27,514",570_0_train
1054,9982,Yes that would have made more sense.,Chandler,3,2,994,2,5,5,"00:15:13,662","00:15:15,997",994_2_train
1055,2184,"Hey, Mon, if you were hoping to sleep with Joshua the first time tonight, which one of these would you want to be wearing.",Rachel,0,0,222,0,4,18,"00:05:35,460","00:05:40,839",222_0_test
1056,1721,We did?,Joey,0,0,175,0,1,9,"0:07:55,224","0:07:55,850",175_0_train
1057,9410,Are you all right?,Phoebe,0,0,939,2,9,1,"00:05:56,898","00:06:01,193",939_2_train
1058,7452,"Okay. He's cute, he's funny, he's-",Shelley,0,0,744,5,1,8,"00:00:33,158","00:00:36,744",744_5_train
1059,300,"I'm sorry. I'm sorry, Phoebe. It's just a little shorter than what we had discussed.",Monica,3,2,25,4,2,1,"00:13:38,818","00:13:44,405",25_4_dev
1060,28,No way!,Chandler,1,2,2,4,3,6,"0:05:58,734","0:05:59,774",2_4_train
1061,521,"Hey-hey-hey! So, how did it go with Dana? Any reason I should leave a block of time open say Thursday?",Joey,0,0,49,11,6,18,"00:13:36,482","00:13:40,235",49_11_train
1062,1188,"Yeah, a slice of cheesecake and-and a date if you’re given’ ‘em out.",Pete,0,0,122,4,3,18,"00:07:02,880","00:07:05,757",122_4_train
1063,338,What?! Joey got a turkey stuck on his head?!,Rachel,1,1,28,8,5,8,"00:04:31,229","00:04:35,524",28_8_dev
1064,178,"Yeah, either that, or he has a really big cat.",Ross,0,0,16,5,3,25,"00:04:57,005","00:04:59,214",16_5_train
1065,5810,Yeah.,Joey,4,1,589,4,7,13,"0:19:12,656","0:19:13,713",589_4_train
1066,9489,"Just wanna check my horoscope, see if it was right.",Phoebe,0,0,946,2,1,11,"0:00:05,095","0:00:06,762",946_2_train
1067,1110,"I said some things that I didn't mean, and he- he threw some faeces...",Ross,0,0,113,6,1,10,"00:08:02,982","00:08:05,192",113_6_train
1068,10119,You're our third call tonight.,Fireman No. 1,0,0,1008,7,1,14,"0:16:49,550","0:16:50,902",1008_7_train
1069,2193,"Where you work the uh, waiters eat with the waiters, right?",Ross,0,0,218,2,4,11,"00:12:19,488","00:12:22,657",218_2_train
1070,544,"I mean, you live alone, you don't walk around naked.",Rachel,0,0,55,1,5,23,"00:05:30,330","00:05:32,706",55_1_test
1071,43,"Ugh, can you believe that guy!",Ross,5,2,3,5,5,15,"00:06:26,177","00:06:28,178",3_5_test
1072,281,Sure! I feel so bad for you. I broke my leg once too.,Phoebe,3,2,28,3,8,23,"0:12:46,670","0:12:49,465",28_3_test
1073,1710,Sing!!,Phoebe,6,2,173,8,6,1,"0:11:06,041","0:11:06,692",173_8_train
1074,2312,"And-and I promise, I won't touch a guitar until you say I'm ready.",Joey,0,0,228,2,5,11,"00:17:06,734","00:17:10,445",228_2_train
1075,1355,What?!,Rachel,1,2,138,13,5,12,"00:12:55,733","00:12:57,650",138_13_train
1076,7911,"Oh what a great picture of your son,  strapping!",Chandler,4,1,796,17,9,2,"00:14:25,072","00:14:27,740",796_17_train
1077,10179,"Well, they’re just gonna have to wait aren’t they? I’ve only got two hands!!",Monica,6,2,1013,1,7,9,"00:14:04,176","00:14:07,512",1013_1_train
1078,3293,"Hey, how are you guys doing?",Phoebe,0,0,329,2,6,6,"0:13:09,830","0:13:11,249",329_2_train
1079,1580,"Ah,",Monica,0,0,162,2,9,23,"0:40:21,753","0:40:22,903",162_2_test
1080,3952,"Look, forget about it, okay?",Joey,6,2,404,7,6,12,"0:03:00,139","0:03:01,613",404_7_train
1081,1934,"Okay look, don't...don't be mad okay?",Chandler,2,2,195,0,6,7,"00:20:04,870","00:20:07,163",195_0_test
1082,3233,Chandler!,Monica,1,1,320,12,6,16,"00:20:49,122","00:20:52,708",320_12_train
1083,6004,"Listen, it was nice to see you. I gotta run backstage.",Steve,4,1,606,4,2,5,"00:18:34,988","00:18:37,406",606_4_train
1084,1598,That-that he’s against marriage and always will be!,Monica,6,2,163,9,6,25,"00:07:15,560","00:07:18,103",163_9_train
1085,2871,You are no longer authorized to distribute birthday muffins.,Gunther,0,0,288,5,6,13,"00:15:50,157","00:15:52,617",288_5_train
1086,1957,Ask again later.,Ross,0,0,196,11,5,4,"00:15:47,196","00:15:48,363",196_11_test
1087,4156,Hey!,Ross,4,1,424,14,4,10,"0:10:07,732","0:10:08,422",424_14_train
1088,1637,Would ya care to venture one?,The Teacher,0,0,167,12,5,9,"0:07:43,588","0:07:45,480",167_12_test
1089,1557,Hey!,Joey,6,2,160,8,6,2,"0:14:44,341","0:14:44,925",160_8_test
1090,5904,I’m pretty sure it’s gun.,Phoebe,0,0,596,14,6,5,"0:14:35,377","0:14:37,339",596_14_train
1091,1160,"I, umm, shut up!",Phoebe,6,2,112,0,4,1,"00:13:29,892","00:13:32,101",112_0_dev
1092,297,What? I didn't say anything.,Monica,1,2,25,1,2,1,"0:13:26,555","0:13:28,453",25_1_dev
1093,9340,"Joey, what are you doing?",Monica,1,2,933,10,6,12,"00:10:23,372","00:10:24,706",933_10_train
1094,742,"Oh, god, I knew it, that I freaked you out.",Rachel,3,2,69,16,7,8,"00:20:30,896","00:20:34,232",69_16_dev
1095,4924,"Okay, so if an eight comes up, we take it as a sign and we do it!",Chandler,4,1,503,5,5,24,"00:12:06,434","00:12:10,228",503_5_train
1096,7896,"It’s a funny story, actually.",Chandler,0,0,796,2,9,2,"0:13:35,648","0:13:38,038",796_2_train
1097,2042,"She, she buys clothes from stores that I'm intimidated by the sales people.",Monica,6,2,204,6,1,21,"00:02:16,261","00:02:19,596",204_6_test
1098,6117,Oh but you could.,Rachel,0,0,614,11,5,18,"0:15:06,572","0:15:07,424",614_11_train
1099,9194,"All right, this has got to stop!",Phoebe,6,2,918,9,4,18,"0:20:47,329","0:20:48,539",918_9_train
1100,79,I’ll see you later.,Joey,0,0,6,13,8,22,"0:13:07,242","0:13:08,202",6_13_train
1101,9898,"No. Joey, she",Rachel,0,0,986,11,5,14,"00:03:34,464","00:03:37,299",986_11_train
1102,1013,"Okay, maybe people give out fake numbers, but they don’t give out fake names.",Monica,6,2,95,2,8,4,"00:12:46,390","00:12:50,226",95_2_dev
1103,1960,"Oh-oh, you lie.",Rachel,5,2,195,11,3,5,"00:19:12,276","00:19:15,069",195_11_train
1104,9040,Thank God.,Rachel,4,1,904,5,4,15,"0:21:32,395","0:21:34,467",904_5_train
1105,1624,Could be Casey.,Chandler,0,0,165,13,4,7,"00:14:58,314","00:14:59,314",165_13_train
1106,1991,"Yeah, maybe.",Phoebe,3,2,199,9,4,20,"00:18:39,451","00:18:40,493",199_9_test
1107,7073,Was it her quarter?,The Security Guard,0,0,699,9,5,24,"0:17:26,520","0:17:26,924",699_9_train
1108,3425,Lean lean lean,Joey,4,1,339,4,4,10,"00:21:04,846","00:21:07,390",339_4_train
1109,2443,That’s just the way it is.,Tour Guide,0,0,246,1,4,11,"00:10:34,967","00:10:36,009",246_1_test
1110,4736,Yeah!,Rachel,4,1,481,1,9,20,"0:02:00,328","0:02:00,777",481_1_train
1111,7883,Call me.,Mrs. Waltham,0,0,794,9,5,1,"00:14:28,617","00:14:30,159",794_9_train
1112,3804,"Joey. Joey, something feels weird and not good weird. I don’t—Whoa!!",Rachel,2,2,383,4,8,14,"00:09:49,600","00:09:54,080",383_4_train
1113,317,Okay.,Ross,0,0,30,9,6,21,"0:04:52,542","0:04:52,844",30_9_train
1114,3860,Pheebs...,Rachel,0,0,389,9,4,2,"0:12:38,424","0:12:39,026",389_9_train
1115,7377,Monica!,Chandler,1,2,737,0,7,12,"0:03:54,150","0:03:55,068",737_0_train
