1781,6248,"Oh, don’t thank me, thank the jerk that never showed up. Okay, I gotta get to get to work.",Chandler,6,2,626,4,3,6,"00:11:05,873","00:11:11,670",626_4_train
1782,6427,"With them, under them, what’s the difference? Eh, Rach?",Joanna,0,0,640,16,4,9,"00:07:32,577","00:07:35,704",640_16_train
1783,8850,Yes that’s right.,Ross,0,0,887,0,6,17,"00:19:26,165","00:19:29,083",887_0_train
1784,1798,"Y’know, y’know I’m lookin’ and I don’t think anyone’s home here.",Ross,0,0,181,1,7,12,"00:14:29,785","00:14:33,955",181_1_train
1785,1052,What?!,Monica,1,2,112,4,8,17,"0:17:46,607","0:17:47,289",112_4_test
1786,5274,"So, if we could just get back to the lecture.",Ross,0,0,531,7,6,4,"00:20:30,062","00:20:33,022",531_7_train
1787,1541,Hey Rach.,Tag,0,0,156,11,8,2,"00:14:34,999","00:14:36,624",156_11_train
1788,10024,"Yeah, all the time. I want the baby to know my voice.",Susan,0,0,999,0,1,9,"00:06:14,457","00:06:17,876",999_0_train
1789,5201,"Oh no, no, no, wait, wait, Isabella.",Ross,4,1,526,5,3,5,"00:20:36,652","00:20:40,821",526_5_train
1790,5089,"Joey, where are the",Monica,0,0,515,5,3,11,"00:06:15,375","00:06:18,126",515_5_train
1791,6490,I’m really not deciding!,Monica,4,1,646,19,7,6,"0:01:16,701","0:01:17,913",646_19_train
1792,8738,"You're independent, and you always have been!",Mr. Geller,0,0,872,7,1,2,"00:09:55,678","00:09:57,637",872_7_train
1793,1511,What is going on?,Mark,1,2,154,3,3,12,"0:14:16,248","0:14:17,920",154_3_train
1794,10173,Doesn't anybody understand that I'm gonna be having babies soon?,Phoebe,1,2,1012,7,5,3,"0:08:27,882","0:08:31,144",1012_7_train
1795,8739,"Even when you were a kid... and you were chubby, and you had no friends, you were just fine!",Mr. Geller,0,0,872,8,1,2,"00:09:57,847","00:10:03,351",872_8_train
1796,6857,"That's alright, I'll take it.",Chandler,0,0,674,5,1,18,"0:12:31,459","0:12:32,419",674_5_train
1797,3108,I think I know that girl.,Joey,0,0,311,6,4,9,"00:00:25,942","00:00:27,985",311_6_train
1798,698,You listen to me!,Rachel,6,2,72,4,8,23,"0:19:19,880","0:19:20,150",72_4_test
1799,35,You can do it!,Ross,4,1,2,8,5,16,"00:07:48,759","00:07:50,010",2_8_test
1800,2956,"Okay, that's great.  No, I'm- Oh.",Ross,4,1,296,11,1,2,"00:15:09,450","00:15:14,704",296_11_train
1801,802,It was. It was an amazing night.,Ross,4,1,76,6,8,4,"0:19:50,868","0:19:53,621",76_6_train
1802,5222,"Yeah, she couldn't live without the Chan Love.",Chandler,4,1,527,4,5,24,"00:08:11,991","00:08:20,290",527_4_train
1803,504,"Well, don't, don't think me immodest, but, me?",Chandler,1,1,47,13,2,6,"00:06:43,820","00:06:48,281",47_13_train
1804,4908,Wo-women? You mean like old women?,Rachel,5,2,501,5,7,5,"00:11:47,790","00:11:51,126",501_5_train
1805,2289,"Don't go anywhere, I'll be right back.",Danny,0,0,226,3,5,7,"00:18:39,660","00:18:41,577",226_3_train
1806,4612,We’re not gonna do that.,Ross,5,2,471,1,8,23,"0:06:25,845","0:06:27,763",471_1_train
1807,343,Wendy bailed. I have no waitress.,Monica,3,2,29,2,1,15,"00:16:07,049","00:16:10,218",29_2_dev
1808,9476,"I don’t mind paying my dues, y'know, its just how much am I gonna learn about fashion by walking Mira, the arthritic seamstress, to the bathroom.",Rachel,5,2,945,5,3,11,"00:05:05,930","00:05:12,644",945_5_train
1809,900,We’re really good.,Chandler,4,1,83,7,8,23,"00:10:53,474","00:10:56,143",83_7_dev
1810,6956,You guys wanna get some coffee?,Rachel,0,0,682,11,1,23,"0:21:53,812","0:21:54,954",682_11_train
1811,2646,The physical act of love.,Ross,4,1,266,10,5,23,"00:10:42,391","00:10:45,018",266_10_test
1812,7952,"All right, Ross, don't squeeze it so hard.",Monica,0,0,801,6,2,6,"00:10:26,334","00:10:28,376",801_6_train
1813,7928,Who's gonna take me to the,Monica,3,2,797,13,1,21,"00:18:29,274","00:18:31,526",797_13_train
1814,4536,Power saw kinda got away from me there.,Joey,0,0,462,10,3,5,"00:00:58,016","00:01:00,809",462_10_train
1815,3579,I'm going into business people.,Monica,0,0,356,15,3,3,"0:02:04,124","0:02:05,546",356_15_train
1816,8671,"I tell you, this wedding is not going to happen.",Emily,4,1,866,2,4,23,"00:19:28,500","00:19:31,460",866_2_train
1817,9149,"Yeah, I think we said good-bye to that when we invented hammer darts.",Joey,4,1,913,12,5,10,"00:09:03,709","00:09:07,003",913_12_train
1818,5059,"Umm Pheebs, remember when we were in the coffee house we decided that I was going to keep the uh, the cute guy’s cell phone?",Rachel,0,0,512,4,7,15,"00:09:41,831","00:09:47,887",512_4_train
1819,4110,"All good, thanks.  Do you maybe have a nickname have like a nickname that’s easier to rhyme?",Phoebe,0,0,420,6,4,10,"00:07:16,561","00:07:23,775",420_6_train
1820,1119,No. No-no. No. What would,Ross,6,2,117,7,6,17,"00:19:22,953","00:19:25,997",117_7_test
1821,2218,Of course not.,Monica,3,2,225,3,3,22,"0:03:45,183","0:03:46,101",225_3_test
1822,8586,"Actually, do you guys mind staying here for a while?",Ross,0,0,857,6,5,1,"00:12:09,353","00:12:14,107",857_6_train
1823,8997,"Janice’s birthday is coming up, I want to get her something speacial. Come in here with me.",Chandler,0,0,901,2,3,8,"00:06:45,905","00:06:53,203",901_2_train
1824,143,Yeah!,Joey,4,1,14,3,6,4,"0:21:29,440","0:21:29,806",14_3_test
1825,813,Are you kidding?,Ross,1,2,86,7,6,9,"00:17:29,923","00:17:30,965",86_7_test
1826,5809,"Well, y’know I’m wearing layers and it’s warm.",Phoebe,0,0,589,3,7,13,"0:19:11,024","0:19:12,656",589_3_train
1827,9553,"No. No, you're not a loser.",All,3,2,950,4,5,11,"00:18:13,675","00:18:16,302",950_4_train
1828,10359,That's not possible!,Monica,4,1,1026,8,5,14,"0:06:53,162","0:06:54,214",1026_8_train
1829,5661,"Hey-hey, now he’s showing us his poking device.",Rachel,1,1,571,14,3,8,"00:21:24,783","00:21:27,785",571_14_train
1830,4411,"Ross, we…we have to be strong. Okay, I-I’m gonna go.  Can I? To remember you?",Mona,3,2,449,12,8,17,"00:21:31,623","00:21:39,797",449_12_train
1831,62,So why don’t you give me your number?,Joey,0,0,5,8,4,20,"00:15:00,024","00:15:02,275",5_8_test
1832,2707,"Oh my God! He's trapped in an ATM vestibule with Jill Goodacre!  Chandler, listen.",Joey,1,1,271,4,1,7,"00:05:16,482","00:05:24,239",271_4_test
1833,598,"So, you stole my joke, and you stole my money.",Chandler,6,2,64,0,6,12,"00:05:41,507","00:05:44,843",64_0_test
1834,1429,Sure. Okay.,Gary,0,0,145,8,5,21,"00:06:18,211","00:06:19,836",145_8_test
1835,5596,"Well, hello, Mrs. Ross!",Ross,4,1,562,9,5,24,"00:21:16,733","00:21:18,985",562_9_train
1836,8282,"Oh, which museum?",Phoebe,0,0,832,7,4,10,"0:00:26,155","0:00:27,614",832_7_train
1837,157,"Hey, you ok?",Ross,0,0,15,8,9,23,"0:42:51,068","0:42:52,950",15_8_train
1838,2226,"Yeah, they’re out of town.",Joshua,0,0,221,1,4,18,"0:11:49,685","0:11:50,769",221_1_train
1839,1685,"Oh my God, you’re back!",Joey,1,1,170,0,6,24,"00:17:08,569","00:17:09,944",170_0_test
1840,6647,"Cause she's, she's alone now, and pregnant, and, and sad.",Ross,3,2,659,6,1,14,"00:15:25,966","00:15:30,386",659_6_train
1841,3151,Totally. I’m like 90/10.,Phoebe,4,1,314,9,6,25,"00:03:06,769","00:03:13,400",314_9_train
1842,8714,I’ll be there.,Gunther,0,0,870,3,4,22,"00:04:47,996","00:04:49,496",870_3_train
1843,3462,"Okay, I-I-I'll be right over.",Joey,4,1,344,12,5,17,"0:02:53,765","0:02:55,362",344_12_train
1844,6517,"Oh, a subscription to",Joey,1,1,649,15,8,12,"00:05:13,646","00:05:17,399",649_15_train
1845,4549,Good idea. Where do you want to go to lunch?,Chandler,0,0,463,12,7,11,"00:05:48,056","00:05:49,473",463_12_train
1846,2596,"Oh I know, I’ve been there. I remember toward the end",Phoebe,0,0,256,8,8,22,"00:02:09,909","00:02:12,287",256_8_train
1847,3477,"Oh right, your allergies.  All her, she hates you.",Chandler,0,0,346,6,6,20,"00:09:20,268","00:09:27,023",346_6_train
1848,2699,"Actually, I'm reading it to the baby.",Susan,0,0,270,11,1,9,"00:05:53,353","00:05:56,104",270_11_test
1849,2199,"Chandler! It happens to lots of guys! You-you-you were probably tired, you had a lot of champagne, don’t worry about it!",Monica,3,2,223,0,7,1,"00:04:12,710","00:04:22,219",223_0_test
1850,2378,"Yeah. But of course we had to update it a little bit.  Hey, by the way, great thinking about catching me!",Monica,4,1,235,2,6,10,"00:21:06,014","00:21:12,812",235_2_train
1851,8914,No.,Monica,0,0,892,12,8,21,"00:04:26,350","00:04:30,229",892_12_train
1852,1486,"Well, you might try accidentally breaking something valuable of hers, say her-",Paul,0,0,152,5,1,1,"00:10:40,890","00:10:44,392",152_5_train
1853,803,"‘Kay look, if I have to go to the doctor for anything it’s gonna be for this thing sticking out of my stomach!",Joey,6,2,85,3,6,4,"00:10:26,292","00:10:31,463",85_3_test
1854,1602,You did! Oh.... I always figured you just thought I was Monica's geeky older brother.,Ross,1,1,164,2,1,1,"00:20:52,084","00:20:58,138",164_2_train
1855,2557,Did you make your deposit?,Janice,0,0,253,7,9,21,"0:17:53,658","0:17:55,034",253_7_train
1856,7426,"Dad, dad I don’t want to hear about it.",Ross,3,2,740,7,7,13,"00:12:30,416","00:12:33,293",740_7_train
1857,5047,"Wow, uh, anything else I should know?",Kristin,1,1,510,5,1,14,"00:12:12,356","00:12:17,485",510_5_train
1858,169,We're academics.,Ross,6,2,15,20,9,23,"0:43:32,788","0:43:33,798",15_20_train
1859,3244,"Uh, the sex.",Eric,0,0,321,5,8,7,"0:16:43,586","0:16:45,311",321_5_train
1860,3197,"Ooh, nice.",Monica,4,1,319,1,3,23,"00:17:40,476","00:17:42,977",319_1_train
1861,3733,What?,Roger,0,0,372,11,1,13,"0:19:43,515","0:19:43,947",372_11_train
1862,7955,Let go of my hand!,Monica,6,2,801,8,2,6,"00:10:31,339","00:10:33,173",801_8_train
1863,5,"Aww, man, now we won’t be bank buddies!",Joey,3,2,1,2,4,4,"00:12:34,211","00:12:37,505",1_2_dev
1864,3167,"I know you can’t stand to be in the same room as me, so I just thought I’d try and apologize over the phone.",Chandler,3,2,316,2,4,8,"00:00:05,588","00:00:11,552",316_2_train
1865,3617,Does that mean the same thing in England as it does in America?,Ross,3,2,359,6,4,17,"00:15:03,569","00:15:07,655",359_6_train
1866,197,This is totally your fault!,Rachel,6,2,17,2,6,5,"0:15:03,110","0:15:04,582",17_2_dev
1867,10150,No-o-o!  No way!,Ross,5,2,1010,9,3,25,"00:07:24,026","00:07:27,696",1010_9_train
1868,9185,Drum roll.,Phoebe,0,0,918,0,4,18,"00:20:04,786","00:20:06,996",918_0_train
1869,750,Shoot! Shoot! Shoot!,All,4,1,70,4,1,4,"0:12:30,511","0:12:33,925",70_4_dev
1870,10436,Yes!  Shame about you man.,Joey,4,1,1035,6,4,22,"00:02:55,758","00:02:58,844",1035_6_train
1871,665,"Well, that would’ve been very hard to say no too.",Rachel,0,0,63,15,8,18,"00:20:30,550","00:20:35,055",63_15_dev
1872,10369,"Umm, well, umm Grandma died.",Phoebe,3,2,1027,2,5,13,"00:05:56,606","00:06:03,153",1027_2_train
1873,5638,Okay but what about y'know my pinchable butt and my bulging biceps—She knows!,Chandler,6,2,568,11,5,14,"00:09:47,169","00:10:00,015",568_11_train
1874,6380,Why am I not surprised?,Ross,5,2,637,5,7,17,"0:14:30,661","0:14:31,829",637_5_train
1875,1926,Where…  Where you will see…a uh…a bunch of uh…red spots.,Ross,0,0,193,3,8,12,"00:17:37,931","00:17:45,438",193_3_test
1876,331,"Oh, this life! Oh okay no, Chandler's is worse.",Phoebe,3,2,28,1,5,8,"00:04:04,118","00:04:06,995",28_1_dev
1877,448,I just wanted to put a nice memory in your head so you'd know that I wasn't always such a terrible guy.,Mr. Tribbiani,0,0,41,7,1,13,"00:05:29,203","00:05:34,333",41_7_train
1878,1465,And I will make everyone call me Mrs. Geller!,Rachel,4,1,151,2,6,1,"00:12:22,867","00:12:26,661",151_2_train
1879,7591,"OK, now I'm gonna kick some ass.",Phoebe,6,2,761,4,2,13,"00:11:04,538","00:11:06,414",761_4_train
1880,4492,"Thanks, Bernice.  Let's go away this weekend.",Barry,0,0,457,4,1,20,"00:06:58,543","00:07:02,879",457_4_train
1881,4482,The little jail between the doors!,Phoebe,6,2,456,6,6,23,"00:13:22,343","00:13:26,221",456_6_train
1882,2186,Sorry.,Rachel,0,0,222,2,4,18,"0:05:45,636","0:05:46,238",222_2_test
1883,8293,He cannot play at our wedding!,Monica,6,2,833,2,7,15,"0:07:49,135","0:07:50,470",833_2_train
1884,2221,"I-I wanted to apologise if I—y’know seemed a tad edgy yesterday at my shower. Y’know it’s just the hormones, y’know.",Phoebe,3,2,220,3,4,22,"00:10:42,433","00:10:51,399",220_3_train
1885,7872,And a crappy New Year.,Rachel,4,1,793,9,1,9,"00:22:02,779","00:22:04,071",793_9_train
1886,8308,"Okay, I’ve got a question. If you had to pick one of us to date, who would it be?",Monica,0,0,834,10,6,12,"00:04:30,478","00:04:35,399",834_10_train
1887,6014,Don't you realise what you're-you're doing to yourself?,Ross,5,2,607,1,1,3,"00:16:52,553","00:16:54,637",607_1_train
1888,10028,"But um, we just refer to you as Bobo the Sperm Guy.",Susan,0,0,999,4,1,9,"00:06:25,301","00:06:30,764",999_4_train
1889,9037,A $200 an hour electrician couldn’t figure out what it did.,Monica,3,2,904,2,4,15,"00:21:23,115","00:21:27,159",904_2_train
1890,7501,"Yeah, I understand.",Richard,0,0,750,0,6,25,"00:14:52,683","00:14:54,183",750_0_train
1891,2996,The Celtics.,Lydia,0,0,300,7,1,23,"0:03:58,279","0:03:59,041",300_7_train
1892,1820,What?! You’re crazy! There’s nothing sexual about the noises I make!,Monica,1,1,184,1,8,14,"00:14:34,000","00:14:37,960",184_1_test
1893,1232,"Well, okay. Would-would you get me a",Rachel,0,0,126,6,6,22,"00:10:32,840","00:10:36,468",126_6_test
1894,8832,"Well, so, why don’t you just turn it off?",Rachel,4,1,886,5,4,17,"00:13:29,934","00:13:31,976",886_5_train
1895,1410,That bitch!,Ross,6,2,144,4,7,11,"00:17:33,093","00:17:34,302",144_4_test
1896,4865,"I’m telling you man, I saw it.",Joey,0,0,497,0,3,8,"00:08:02,482","00:08:04,149",497_0_train
1897,5662,"Hey, that’s never gonna make it all the way over here, buddy!",Joey,6,2,571,15,3,8,"00:21:28,787","00:21:33,332",571_15_train
1898,525,"Look, Carol never threw me out of a room before you came along.",Ross,6,2,49,2,1,23,"00:09:18,724","00:09:21,685",49_2_dev
1899,4657,"Oh,",Chandler,0,0,475,11,9,23,"0:31:54,797","0:31:55,559",475_11_train
1900,5354,"Eh, I mean, I mena she's not unattractive but hot? I ....",Ross,1,1,539,3,9,12,"00:01:16,326","00:01:23,499",539_3_train
1901,10465,"Don’t tell me, because of the big nostril thing?",Ross,1,2,1038,4,2,3,"00:00:11,136","00:00:13,887",1038_4_train
1902,2370,Stop making candy!,Chandler,6,2,234,6,7,9,"0:11:42,743","0:11:45,063",234_6_train
1903,3999,"Oh, we went to see a collection of Victorian doorknobs and the Cupert-Hewitt museum.",Ross,0,0,409,6,4,16,"00:02:16,719","00:02:20,806",409_6_train
1904,9957,"I-I-I’m sorry, your-your mouth was full, I didn’t hear what you said. Umm, hats off to who now?",Monica,0,0,991,12,8,21,"00:13:40,153","00:13:45,450",991_12_train
1905,1571,"Hi, Ross.",Mark,0,0,160,3,3,14,"00:05:33,124","00:05:34,374",160_3_train
1906,7619,That’s great. Good for you guys.,Phoebe,4,1,766,1,6,12,"00:13:27,223","00:13:29,390",766_1_train
1907,8848,"No-no, I know that, but I just have to make enough money for the second part of my plan.",Phoebe,0,0,886,21,4,17,"00:14:13,519","00:14:16,479",886_21_train
1908,6099,Nestley Toulouse.,Phoebe,0,0,613,5,7,3,"00:18:33,028","00:18:36,280",613_5_train
1909,994,"Do you still have that, um, Navy uniform?",Rachel,4,1,107,2,3,1,"00:05:52,692","00:05:56,438",107_2_test
1910,4040,"Hey, the ad alone cost 300 bucks!",Joey,0,0,412,12,4,2,"00:04:52,583","00:04:55,544",412_12_train
1911,6512,"Although, I have a hint of morning sickness, and I’m wearing underwear that goes up to about……there.",Rachel,0,0,649,10,8,12,"00:04:56,462","00:05:01,758",649_10_train
1912,1191,"Aww, the only reason you want to go out with me because my blond wig, and the big boobs, and the fact that I serve you food.",Monica,4,1,122,7,3,18,"00:07:08,386","00:07:15,475",122_7_train
1913,3499,"So, do you guys wanna come and eat dinner at the restaurant    sometime in the next few weeks?",Monica,0,0,349,3,9,19,"00:01:55,491","00:01:58,953",349_3_train
1914,3682,Wait here. Breathe.,Phoebe,0,0,366,14,1,5,"00:20:07,915","00:20:09,749",366_14_train
1915,7279,"Thanks for letting me stay here! I mean Monica’s place was nice, but her fiancée sure stares a lot.",Cassie,4,1,726,2,7,19,"00:12:38,382","00:12:46,055",726_2_train
1916,7722,"Oh, okay, yeah.  I put your stuff in her room, and her stuff in your room.",Phoebe,0,0,776,7,3,22,"00:09:41,789","00:09:45,041",776_7_train
1917,560,"You want me, you want me to quit my job so you can feel like you have a girlfriend?",Rachel,6,2,51,10,3,15,"00:11:56,590","00:11:59,467",51_10_train
1918,2792,My God! Is this a gym card?,Monica,1,1,279,6,4,4,"00:03:15,361","00:03:17,863",279_6_train
1919,63,"I don’t have a key, they took mine to give to you.",Joey,0,0,6,7,8,3,"0:03:31,211","0:03:33,589",6_7_dev
1920,9983,"Y'know, I-I don't even feel like I know you anymore man!",Joey,6,2,994,3,5,5,"00:15:17,082","00:15:20,043",994_3_train
1921,949,Oh my!,Joey,1,1,95,1,5,3,"00:04:04,619","00:04:05,953",95_1_train
1922,4404,"Listen Ross, you don’t have to apologize. I understand why you were there.",Mona,0,0,449,5,8,17,"00:20:58,090","00:21:02,802",449_5_train
1923,1124,Ow!,Phoebe,6,2,108,4,5,3,"0:05:41,132","0:05:41,466",108_4_dev
1924,8368,"One, my friends are the most important thing in my life, two, I never lie, and three, I make the best oatmeal raisin cookies in the world.",Phoebe,0,0,840,9,1,12,"00:13:24,720","00:13:35,480",840_9_train
1925,6065,"No, it's ok! Made me feel like a rock star!",Ross,4,1,610,4,9,23,"00:30:52,725","00:30:55,686",610_4_train
1926,4453,Wait! Wait! Maybe she’s a hooker,Joey,1,1,453,1,8,8,"00:12:23,367","00:12:26,828",453_1_train
1927,3681,I'm not fine. Here she comes.,Chandler,2,2,366,13,1,5,"00:20:05,871","00:20:07,705",366_13_train
1928,451,"Okay Joey, first of all Kash Ford is not people. Second of all, what did he say when you told him I was pregnant?",Rachel,6,2,40,6,8,5,"00:06:56,874","00:06:58,750",40_6_dev
1929,1360,Who cares? I repel women.,Ross,5,2,138,1,6,7,"00:15:16,081","00:15:18,708",138_1_test
1930,89,Joey! He’s working!  You would look,Monica,6,2,9,7,6,18,"00:05:18,443","00:05:24,031",9_7_test
1931,1458,I don’t care!  I don’t care!!,Chandler,6,2,150,1,3,8,"00:19:48,687","00:19:53,608",150_1_test
1932,8080,Mm-Hm,Ross,0,0,812,15,5,19,"0:22:02,867","0:22:04,037",812_15_train
1933,340,You have to tell her!,Ross,4,1,32,11,1,12,"00:11:36,779","00:11:39,531",32_11_train
1934,4220,That's not a trip!,Phoebe,1,2,431,10,5,2,"0:14:54,268","0:14:55,728",431_10_train
1935,536,"So just stop all the yelling, just stop it!",Phoebe,6,2,49,11,1,23,"00:09:45,626","00:09:48,086",49_11_dev
1936,3040,What’s going on?,Chandler,1,2,304,5,3,5,"0:11:39,949","0:11:40,841",304_5_train
1937,130,Good! A verbal contract is binding in the state of New York!,Ross,4,1,12,19,6,3,"00:14:00,548","00:14:04,217",12_19_test
1938,7328,"Hey, so did everything go all right with the annulment?",Rachel,0,0,733,1,6,1,"00:20:37,569","00:20:40,738",733_1_train
1939,9224,Um-hmm.,Rachel,0,0,922,7,4,23,"0:12:30,374","0:12:32,043",922_7_train
1940,1291,I don’t see the baby. Where is it?,Joey,0,0,131,7,8,3,"00:21:39,047","00:21:40,673",131_7_test
1941,3985,"We're on in 3, 2,",Stage Director,0,0,407,9,5,4,"00:14:22,611","00:14:25,405",407_9_train
1942,1454,"Aw, don't do that",Chandler,3,2,148,20,1,12,"00:08:29,800","00:08:31,551",148_20_train
1943,9486,Do you want my pickle?,Rachel,0,0,945,15,3,11,"00:05:51,017","00:05:52,267",945_15_train
1944,2334,Is it better than the other salmon mousse?,Monica,0,0,237,0,1,15,"00:07:10,930","00:07:13,390",237_0_test
1945,7986,"Whoa-whoops, I almost lost this baby!",Ross,4,1,805,5,4,5,"00:00:37,829","00:00:41,749",805_5_train
1946,701,Really?,Rachel,1,1,65,1,1,7,"00:08:15,912","00:08:17,496",65_1_train
1947,3978,"Now, y'know the bee probably died after he stung ya.",Joey,0,0,407,2,5,4,"00:13:51,872","00:13:55,542",407_2_train
1948,111,Nobody!,Phoebe,6,2,10,0,5,10,"0:11:57,091","0:11:58,551",10_0_train
1949,987,"Well, get rid of her, obsessive and shrill.",Chandler,0,0,99,10,7,19,"00:05:54,312","00:05:56,438",99_10_train
1950,1357,All right. So you're telling me that there is nothing going on between you and Chandler.,Rachel,6,2,138,15,5,12,"00:13:08,329","00:13:11,956",138_15_train
1951,2705,"You'd better do something, or I'm gonna walk out that door right now! Well? Are you gonna?",Katie,6,2,271,9,5,15,"00:15:36,769","00:15:43,483",271_9_train
1952,2466,"All I could think of was y’know, ""Is he gonna kiss me? Is he gonna kiss me?""",Phoebe,4,1,245,3,7,18,"00:07:03,131","00:07:06,216",245_3_train
1953,6675,Let’s go.,Rachel,0,0,660,13,6,23,"0:05:25,667","0:05:27,423",660_13_train
1954,6830,Yes.,Ross,0,0,673,1,6,2,"00:15:07,156","00:15:08,197",673_1_train
1955,3399,"Well, I’m sure they’re still somewhere here in the hotel. I’ll-I’ll help you look for them.",Ross,0,0,337,17,8,2,"00:03:45,475","00:03:50,437",337_17_train
1956,9018,How are you feeling?,Chandler,0,0,902,3,7,14,"00:14:22,444","00:14:23,778",902_3_train
1957,942,"Me taking care of you is no problem, huh?",Phoebe,0,0,100,0,6,5,"00:15:38,938","00:15:41,606",100_0_test
1958,6337,"Yeah, we got him back. Everything’s fine.",Rachel,0,0,633,8,7,24,"0:08:22,084","0:08:23,544",633_8_train
1959,2008,Can I tell you something? Me too.,Joey,6,2,200,5,6,23,"00:13:53,415","00:14:01,339",200_5_train
1960,7464,"Hey, man. What's up?",Chandler,0,0,745,5,3,4,"00:02:09,879","00:02:13,924",745_5_train
1961,7759,"One more chance Ursula, please?",Guy,3,2,780,6,3,3,"0:02:56,482","0:02:58,931",780_6_train
1962,7210,"Yeah, it’s not mine.",Joey,0,0,719,1,6,5,"00:03:19,282","00:03:21,491",719_1_train
1963,6552,Is it? Feels like two.,Ross,3,2,652,3,1,6,"00:02:01,412","00:02:03,205",652_3_train
1964,5517,"God, Ross is on a date with your sister! How weird is that?!",Monica,5,2,554,9,6,13,"00:20:31,104","00:20:34,190",554_9_train
1965,4357,And I wanna know why?!!,Dr. Green,6,2,445,16,8,8,"0:08:50,697","0:08:52,914",445_16_train
1966,599,"Well, I was going to stick it in the ATM, but now I think I’ll show the sexy teller that I am a published writer.",Ross,0,0,64,1,6,12,"00:05:45,219","00:05:53,310",64_1_test
1967,7688,"That’s right Wesley! I just stopped by to say that, you’re not a real doctor! And that woman’s brain, is fine!",Dr. Drake Remoray,6,2,772,3,6,15,"00:20:20,052","00:20:32,188",772_3_train
1968,7570,"Well, I'm sorry if my friends aren't as sophisticated as yours.",Chandler,6,2,759,5,3,4,"00:17:08,861","00:17:11,988",759_5_train
1969,2680,"Don't worry, after a while he'll tune it out.",Monica,0,0,268,11,9,22,"00:03:32,837","00:03:36,632",268_11_test
1970,1419,I believe you know my husband.,Frannie,0,0,144,13,7,11,"00:18:03,165","00:18:05,166",144_13_test
1971,9596,"I don't know, I mean I'm not sure  ...",Mike,0,0,953,19,9,12,"00:09:00,665","00:09:02,415",953_19_train
1972,8935,It’ll be me!,Joey,4,1,893,13,7,16,"0:05:25,742","0:05:26,714",893_13_train
1973,10082,"Larry, okay, can't you just be Larry and not Larry the health inspector guy?",Phoebe,0,0,1005,15,5,7,"00:15:36,018","00:15:41,606",1005_15_train
1974,2262,"Y'know what, champ? I think I'll pass.",Monica,0,0,223,11,5,4,"00:13:05,618","00:13:09,037",223_11_train
1975,913,Come on!,Rachel,6,2,89,11,4,20,"0:09:56,679","0:09:57,472",89_11_train
1976,5773,"This is your grandmother’s engagement ring, I want you to give it to Rachel.",Mrs. Geller,4,1,584,7,8,23,"00:07:09,750","00:07:14,130",584_7_train
1977,3077,Do you love her?,Monica,0,0,307,6,4,17,"00:04:37,026","00:04:38,028",307_6_train
1978,3155,Remember that guy from cooking school I told you about that put cilantro with everything?,Monica,0,0,315,0,4,9,"00:01:38,056","00:01:41,308",315_0_train
1979,3847,"You should ah, you should just leave it.",Joey,0,0,388,13,3,5,"0:06:36,312","0:06:38,219",388_13_train
1980,8287,"No, I’m getting back down ‘cause she lives in Poughkeepsie.",Ross,0,0,832,12,4,10,"00:00:44,669","00:00:47,046",832_12_train
1981,1021,Oh we-we didn’t.,Rachel,4,1,104,1,8,23,"00:21:15,011","00:21:16,596",104_1_train
1982,468,"So I, I told Rachel it was just gonna be the two of us.",Monica,0,0,47,11,6,2,"00:14:08,305","00:14:11,432",47_11_test
1983,7820,They made you head of the department!,Rachel,4,1,791,0,8,12,"00:01:55,115","00:02:00,202",791_0_train
1984,2831,I don’t know.  A cowboy theme?,Phoebe,0,0,284,2,7,19,"0:05:18,826","0:05:21,627",284_2_train
1985,4600,What? He’s gonna be dressed as a baby!  Oh hi Mrs. Green!,Phoebe,1,1,468,2,8,20,"00:04:45,148","00:04:52,780",468_2_train
1986,4106,"Oh, yay!",Phoebe,4,1,420,2,4,10,"0:06:56,124","0:06:56,360",420_2_train
1987,1560,"Like he came by to pick me up, and I opened the door, and it was just like, click!",Joanna,4,1,159,3,3,20,"00:09:41,998","00:09:46,293",159_3_train
1988,472,"Jen, I know this may sound a little… But uh, would you maybe wanna grab a cup of coffee sometime, or",Ross,0,0,44,4,5,17,"00:13:33,229","00:13:44,239",44_4_dev
1989,4625,Hey.,Chandler,0,0,473,4,9,2,"00:11:36,028","00:11:37,070",473_4_train
1990,241,And it's not even born yet.,Phoebe,3,2,19,20,1,23,"00:15:25,424","00:15:27,842",19_20_dev
1991,7762,Good deal.,Vince,4,1,781,1,3,23,"00:02:18,555","00:02:20,556",781_1_train
1992,5045,You mean they're lovers.,Kristin,1,1,510,3,1,14,"00:12:07,059","00:12:08,768",510_3_train
1993,8773,"Excuse me, umm, can I talk to you over here for just a second?",Monica,6,2,875,8,5,5,"00:08:01,856","00:08:04,983",875_8_train
1994,2875,Did you tell your sister to ask me out?,Ross,0,0,288,9,6,13,"00:16:00,250","00:16:02,502",288_9_train
1995,6157,"Well, no. But, um, I bet she probably does.",Monica,0,0,617,1,7,10,"00:03:16,029","00:03:18,530",617_1_train
1996,7000,The guy who took Rachel to the prom? Why is he calling you?,Ross,1,1,689,6,4,2,"00:01:51,069","00:01:58,534",689_6_train
