1800,7673,"Felicity and I, we’re watching",Joey,0,0,771,6,5,1,"00:15:24,965","00:15:29,177",771_6_train
1801,7988,Thank you.,Phoebe,0,0,805,7,4,5,"00:00:56,014","00:00:57,222",805_7_train
1802,1022,We can't do that.,Joey,0,0,109,6,1,14,"00:07:20,148","00:07:21,606",109_6_test
1803,493,"Yeah, I can say that I have a conference and you can say you have a chef thing.",Chandler,0,0,49,13,5,5,"00:01:01,102","00:01:05,064",49_13_test
1804,542,Ah-ah!!,Joey,1,2,50,9,6,21,"0:14:31,956","0:14:33,140",50_9_train
1805,3120,Noo.,Rachel,3,2,312,5,3,25,"0:16:32,283","0:16:34,132",312_5_train
1806,2215,"Thank you for your patience, you’re the next caller.",Hold Voice,0,0,225,0,3,22,"00:03:29,584","00:03:32,461",225_0_test
1807,7386,"Hey Ross! So, I was checking out the uh, real estate section",Monica,3,2,738,0,7,13,"00:01:53,029","00:01:56,198",738_0_train
1808,4644,Surprise,Joey,4,1,474,17,7,19,"0:20:02,668","0:20:03,170",474_17_train
1809,8643,How she was always stealing them from- from restaurants.,Ross,4,1,861,17,1,8,"00:04:54,294","00:04:57,504",861_17_train
1810,10006,There’s no ‘or’ in mind. What is wrong with these pants?!!,Ross,6,2,996,16,4,23,"00:11:46,122","00:11:50,625",996_16_train
1811,6927,"Now look, there’s only one problem though.",Monica,4,1,680,3,6,18,"00:09:01,249","00:09:02,582",680_3_train
1812,916,Uh-oh!,Joey,2,2,97,8,5,22,"0:21:07,224","0:21:07,776",97_8_test
1813,6415,You mean those-those little colored labels you put on all the folders?,Joanna,0,0,640,4,4,9,"0:06:38,065","0:06:38,209",640_4_train
1814,3509,"I know, it is isn’t it?",Monica,4,1,350,1,3,6,"00:18:57,886","00:18:59,554",350_1_train
1815,7574,A woman's,Chandler,0,0,759,9,3,4,"0:17:18,120","0:17:19,012",759_9_train
1816,3051,"Okay, that hurt us.",Chandler,4,1,305,5,3,15,"00:02:56,384","00:02:58,427",305_5_train
1817,3600,Why? Why can’t you go to him?,Ross,1,1,358,8,3,8,"00:00:30,030","00:00:31,280",358_8_train
1818,1381,"Umm, this stuffing is amazing. Do you think we should bring them some?",Phoebe,4,1,143,3,3,9,"00:22:02,070","00:22:05,948",143_3_train
1819,1168,This is so great! Now we can enter into doubles tournaments!,Monica,4,1,122,3,9,23,"00:46:27,117","00:46:32,038",122_3_test
1820,5423,Come on. An 80-foot inflatable dog let loose over the city. How often does that happen?,Chandler,1,2,545,10,1,9,"00:14:03,717","00:14:09,222",545_10_train
1821,7654,"Can you just pick one so I can watch--have a perfect, magical weekend together with you.",Chandler,6,2,770,5,5,5,"00:08:23,920","00:08:30,509",770_5_train
1822,489,Hey!,Chandler,4,1,49,9,5,5,"0:00:51,134","0:00:51,686",49_9_test
1823,684,"I mean, no-no-no-no-no, don’t you worry, I’m sure with your qualifications you won’t need to sleep with some guy to get that job.",Joanna,0,0,65,7,4,9,"00:04:38,987","00:04:45,200",65_7_dev
1824,1790,...I dunno.,Chandler,0,0,180,7,1,20,"00:22:22,174","00:22:23,924",180_7_test
1825,950,Sorry!,Ross,3,2,89,7,2,6,"0:12:35,144","0:12:35,290",89_7_dev
1826,1994,I wanna say a disease.,Rachel,0,0,199,5,6,19,"00:20:58,298","00:21:00,466",199_5_train
1827,10146,"Come on! When you go away, you-you have to play, it’s like a law!",Joey,3,2,1010,5,3,25,"00:07:12,807","00:07:16,476",1010_5_train
1828,950,They're male nurses.,Rachel,0,0,95,2,5,3,"00:04:07,372","00:04:09,206",95_2_train
1829,269,It was my,Ross,0,0,22,10,1,4,"00:18:07,586","00:18:10,379",22_10_dev
1830,8137,"No I’m serious, we should tell each other",Chandler,0,0,819,7,7,4,"00:06:11,621","00:06:15,749",819_7_train
1831,3679,I'm fine.,Chandler,0,0,366,11,1,5,"0:20:03,285","0:20:04,047",366_11_train
1832,7323,You got to tell me exactly what to do there.,Joey,0,0,730,13,9,21,"00:12:09,895","00:12:12,605",730_13_train
1833,782,"I mean I’ll have to check with him first, but I’ll think he’ll be cool with it.",Joey,0,0,80,9,4,4,"00:07:19,522","00:07:22,065",80_9_test
1834,3586,This will just be my batch.,Joey,0,0,356,22,3,3,"00:02:25,395","00:02:27,396",356_22_train
1835,10438,"Umm, slight change of plans. We've shut down.",Stanley,3,2,1036,1,5,22,"00:19:21,201","00:19:25,371",1036_1_train
1836,9786,"All right, there are no questions in the happy place. Okay, just, the warm breeze, and the moonlight flowing through the trees....",Phoebe,4,1,973,12,3,1,"00:13:16,295","00:13:28,890",973_12_train
1837,7878,She’s-she’s just a friend and that’s all!,Ross,6,2,794,4,5,1,"0:14:12,017","0:14:13,477",794_4_train
1838,4273,"Ah well, this is the living room.",Richard,0,0,438,4,3,13,"00:18:50,671","00:18:52,880",438_4_train
1839,55,Good.,Rachel,6,2,5,12,2,7,"0:19:32,440","0:19:33,256",5_12_dev
1840,3082,I am a good kisser.,Ross,0,0,307,11,4,17,"00:05:08,808","00:05:10,851",307_11_train
1841,5560,Honey! Dinner’s ready!,Monica,4,1,560,0,7,16,"00:20:03,994","00:20:05,828",560_0_train
1842,707,"Just listen, Monica, I, do you know, okay, do you know, I couldn’t sleep for like a month because I got like a dot of ink on one of the sofa cushions.",Phoebe,0,0,66,2,3,6,"00:14:28,117","00:14:35,623",66_2_train
1843,949,I just have to clean that up.,Phoebe,0,0,100,7,6,5,"0:15:55,956","0:15:57,124",100_7_test
1844,4494,"We can, we can go to Aruba!",Barry,4,1,457,6,1,20,"00:07:05,508","00:07:07,134",457_6_train
1845,1883,Hi!,Bonnie,4,1,187,2,3,24,"00:08:27,423","00:08:28,507",187_2_train
1846,8624,"Yeah,  a Pretty Huge",Jim,4,1,860,14,8,17,"0:13:55,185","0:13:57,257",860_14_train
1847,7852,"Okay. . Hello Drake, I'm surprised to see you    here.",Rachel,1,2,792,10,9,19,"00:09:51,842","00:09:59,850",792_10_train
1848,9327,No.,Rachel,0,0,932,14,9,20,"0:22:52,943","0:22:54,407",932_14_train
1849,1086,This is not going to work.,Chandler,6,2,104,5,5,8,"00:20:42,366","00:20:43,699",104_5_dev
1850,1145,It’s not a real game! I made it up!,Chandler,6,2,118,4,6,6,"00:21:19,820","00:21:21,904",118_4_train
1851,881,"Oh hey, Ross.",Steve,0,0,95,16,5,15,"00:13:42,363","00:13:43,863",95_16_test
1852,75,"Oh, Bob, he was nothing compared to you. I had to bite my lip to keep from screaming your name.",Jade,3,2,8,0,2,5,"00:16:47,631","00:16:57,223",8_0_test
1853,7984,"Yeah-yeah, there it is, just a phone number a really hot girl gave me.",Ross,4,1,805,3,4,5,"00:00:18,143","00:00:24,023",805_3_train
1854,2127,Action!,The Director,0,0,209,0,6,4,"00:17:58,243","00:17:59,535",209_0_train
1855,8343,No I’m not.,Ursula,6,2,839,0,6,14,"00:16:26,860","00:16:30,446",839_0_train
1856,2622,MY SANDWICH!!!!!!,Ross,6,2,259,3,5,9,"0:13:34,105","0:13:36,303",259_3_train
1857,7232,No-no-no-no!,Chandler,2,2,720,15,5,7,"00:10:39,430","00:10:41,389",720_15_train
1858,9406,"Oh, she’s not home huh?",Joey,1,2,938,8,3,20,"00:22:28,764","00:22:30,723",938_8_train
1859,9775,Listen to the plinky-plunky music.,Phoebe,0,0,973,1,3,1,"00:12:35,045","00:12:39,174",973_1_train
1860,5246,What?!,Phoebe Sr,1,2,530,3,3,25,"00:19:05,102","00:19:06,561",530_3_train
1861,7321,"Whoa, whoa, whoa! Slow down, you go",Joey,1,2,730,11,9,21,"00:12:03,806","00:12:07,892",730_11_train
1862,1379,"Yes. Yes, there is, they play on Sundays and Monday nights.",Chandler,0,0,143,1,3,9,"00:21:53,854","00:21:56,605",143_1_train
1863,707,Go get back on that case honey!,Rachel,6,2,72,13,8,23,"0:19:42,795","0:19:45,986",72_13_test
1864,139,How scary is that?,Frank,1,1,13,7,5,3,"00:16:28,529","00:16:30,405",13_7_dev
1865,7886,"Well, I don’t know!!",Joey,1,2,795,1,7,6,"0:05:00,302","0:05:01,517",795_1_train
1866,946,"Okay, after I get rid of this dirty diaper Leslie, I’ll set you up with a clean one.",Phoebe,0,0,100,4,6,5,"00:15:48,447","00:15:52,659",100_4_test
1867,1763,Okay get your coat!  Oh! When did you unhook this?  Nice work!,Rachel,4,1,175,22,7,12,"00:09:14,512","00:09:18,557",175_22_test
1868,1182,Okay.,Chandler,0,0,121,6,4,14,"00:12:41,469","00:12:43,011",121_6_train
1869,9525,"Well, you said that you had customers lined up in the street,    so I am here to entertain!",Phoebe,4,1,948,5,9,19,"00:06:42,361","00:06:46,365",948_5_train
1870,8635,"Okay, relax, relax.",Ross,0,0,861,9,1,8,"00:04:27,558","00:04:28,850",861_9_train
1871,7989,I don’t know how any of these got opened?!,Monica,1,2,806,0,8,2,"00:17:21,373","00:17:23,833",806_0_train
1872,2211,Oh wait! That can't be the one Rachel's talking about. She didn't even know that happened. So which one was it?,Phoebe,0,0,219,7,5,8,"00:07:05,967","00:07:13,723",219_7_train
1873,208,No!,Joey,4,1,20,5,7,7,"0:11:04,760","0:11:05,303",20_5_train
1874,5004,"Okay, uh well, let's try one. Whenever you guys are ready.",The Casting Director,0,0,508,4,5,18,"00:16:40,124","00:16:43,501",508_4_train
1875,9518,"Monica, you go to the head of the class.",The Cooking Teacher,0,0,947,14,8,21,"0:09:43,041","0:09:45,002",947_14_train
1876,7895,What?,Ms. McKenna,1,2,796,1,9,2,"0:13:34,980","0:13:35,648",796_1_train
1877,2042,Hey Ross! The baby’s kicking!,Joey,4,1,203,0,8,14,"00:06:26,200","00:06:28,160",203_0_train
1878,2142,I remember when we first got engaged.,Mr. Geller,4,1,211,2,7,2,"00:09:33,239","00:09:35,490",211_2_train
1879,393,"Yeah! Okay, this one is a mushroom cap.  Umm, this one is made of bologna.",Monica,4,1,37,2,7,19,"00:15:49,073","00:15:53,910",37_2_train
1880,398,"Oh yeah, that was great. Thanks to you, the hottest cocktail waitress there is quitting to teach the third grade!",Chandler,6,2,41,1,4,14,"00:17:32,468","00:17:37,221",41_1_test
1881,1263,"Let's try it again, and this time let's watch everybody watch Joey.",Director,0,0,129,5,3,12,"00:17:48,817","00:17:53,446",129_5_test
1882,1179,Just don’t pick up your phone.,Monica,0,0,123,8,8,5,"00:08:55,117","00:08:57,994",123_8_test
1883,1425,It is a crime that you and I don't spend more time together.,Chandler,0,0,145,4,5,21,"00:06:04,781","00:06:06,948",145_4_test
1884,8198,How's the maniac?,Ross,0,0,823,1,3,3,"00:16:01,418","00:16:02,669",823_1_train
1885,894,Excellent.,Joey,4,1,87,7,1,5,"00:22:11,204","00:22:12,246",87_7_train
1886,1031,"Let it go, Ross.",Joey,0,0,107,0,1,3,"00:07:33,578","00:07:35,120",107_0_train
1887,7705,"That was 10 blocks from here and, the, the woman was walking alone at night, I would never do that.",Rachel,3,2,774,1,2,4,"00:00:05,338","00:00:11,010",774_1_train
1888,4337,"I wasn't by myself. I had a doctor, a nurse, and a helper guy.  So, did you see who won the game?",Lydia,0,0,444,4,1,23,"00:13:38,067","00:13:47,242",444_4_train
1889,5272,"I was really nervous and the accent just uh, just came out.",Ross,3,2,531,5,6,4,"00:20:21,428","00:20:25,806",531_5_train
1890,4186,"No-no-no, that’ not Joshua.",Rachel,6,2,428,6,4,14,"00:21:41,925","00:21:43,759",428_6_train
1891,1574,What?,Ross,2,2,160,6,3,14,"0:05:38,922","0:05:39,530",160_6_train
1892,10478,"That was a good one. For a second there, I was like, ""whoa.""",Joey,4,1,1038,17,2,3,"00:01:08,401","00:01:12,071",1038_17_train
1893,262,That she left you?,Chandler,1,2,22,3,1,4,"0:17:43,563","0:17:44,365",22_3_dev
1894,534,And based on the fact that Mr. Geller is intravenous drug user.,Judge,0,0,54,4,6,5,"00:10:45,770","00:10:49,439",54_4_test
1895,348,"It’s not like, I haven’t any opportunities.",Monica,6,2,34,7,6,15,"00:18:25,979","00:18:28,689",34_7_test
1896,20,Well! Well! Well! Joey Tribbiani! So you came back huh? They,Estelle,1,1,2,1,6,4,"00:08:53,241","00:09:01,206",2_1_dev
1897,857,"Honey, we've been trying to have a baby for over a year.",Monica,0,0,79,8,9,21,"00:06:03,571","00:06:05,655",79_8_dev
1898,4100,Yeah.,Cliff,0,0,418,20,8,23,"0:18:38,147","0:18:39,566",418_20_train
1899,3163,Oh.,Monica,4,1,315,8,4,9,"00:02:12,000","00:02:13,006",315_8_train
1900,2585,I'm like those women that you see with shiny guys named Chad.,Monica,5,2,255,13,1,22,"00:13:16,837","00:13:22,091",255_13_train
1901,6406,"Ok, That's it, Ben.",Ross,0,0,639,6,1,23,"00:16:38,747","00:16:42,583",639_6_train
1902,585,"Oh, Chandler, look. You and Monica are meant to have children.    I am sure it's gonna be just fine.",Janice,0,0,60,1,9,21,"00:18:17,096","00:18:22,642",60_1_test
1903,1537,"Uh, let’s rip!",Rachel,2,2,156,7,8,2,"0:14:27,992","0:14:28,743",156_7_train
1904,503,Hello.,Joey,0,0,47,12,2,6,"00:06:37,814","00:06:39,314",47_12_train
1905,6840,I see. Have you considered therapy?,Russell,0,0,673,11,6,2,"00:15:52,201","00:15:56,412",673_11_train
1906,2957,Thanks.,Carol,0,0,296,12,1,2,"00:15:15,706","00:15:17,165",296_12_train
1907,937,I can’t believe this! How long as this been going on?,Phoebe,1,2,88,0,8,14,"00:01:10,560","00:01:12,960",88_0_dev
1908,2426,Two.,Chandler,0,0,244,11,3,6,"0:03:04,978","0:03:05,480",244_11_test
1909,983,"Technically we could have sex again. What do you think, bossy and domineering?!",Chandler,0,0,99,6,7,19,"00:05:38,379","00:05:46,136",99_6_train
1910,5144,"Please, don’t play the music. Just uh one more.",Phoebe,4,1,522,6,7,18,"00:21:41,008","00:21:43,342",522_6_train
1911,513,Ah!  Oh.,Ross,1,2,47,9,3,17,"00:12:39,300","00:12:42,242",47_9_dev
1912,4439,"No, I have just to have two more points to beat him!",Monica,4,1,451,2,9,23,"0:43:56,925","0:43:58,886",451_2_train
1913,3149,"Oh no! No God, definitely not jealous!",Phoebe,0,0,314,7,6,25,"00:02:52,172","00:02:56,008",314_7_train
1914,1071,"Besides y’know, nothing goes with Bing.",Monica,0,0,103,3,8,24,"0:13:55,072","0:13:57,909",103_3_dev
1915,72,"I love the specifics, the specifics were the best part!",Chandler,4,1,6,6,8,22,"00:12:38,954","00:12:43,000",6_6_train
1916,4501,"I'm twelve, I'm not stupid.",Bobby,2,2,457,13,1,20,"0:07:42,211","0:07:44,949",457_13_train
1917,604,Come here!,Joey,4,1,54,22,8,10,"0:21:03,179","0:21:04,950",54_22_train
1918,5683,Don’t you talk to my husband like that you stupid bastard!,Evil Bitch,6,2,572,20,8,23,"00:10:18,439","00:10:21,859",572_20_train
1919,3743,I can’t believe we’re here.,Monica,4,1,374,0,8,3,"0:15:21,629","0:15:23,173",374_0_train
1920,1289,"Oh hey, show them the picture of your uterus.",Ross,0,0,131,5,8,3,"0:21:29,968","0:21:32,932",131_5_test
1921,8682,I have a bone to pick with you.,Ross,6,2,867,1,7,16,"00:06:03,654","00:06:06,239",867_1_train
1922,9385,"Look, Rachel, if you go, you’re just gonna mess with his head and ruin his wedding!",Phoebe,6,2,936,16,4,23,"00:21:00,467","00:21:04,720",936_16_train
1923,1430,"Uh, are you crazy? Are you insane? If you live with Phoebe, you two are gonna be y'know, live-living together!",Chandler,1,1,145,9,5,21,"00:06:20,421","00:06:28,136",145_9_test
1924,749,"Oh, I found him. He was Paolo's cat.",Rachel,0,0,76,15,1,7,"00:16:16,558","00:16:18,977",76_15_test
1925,2482,"I know Mona, just hear me out.",Rachel,0,0,246,2,8,8,"00:17:27,588","00:17:29,547",246_2_train
1926,9754,Here you go.,Gunther,0,0,969,4,6,23,"00:09:16,347","00:09:17,556",969_4_train
1927,2393,How can I answer that when I’m pretending I don’t know you?,Chandler,0,0,236,7,4,23,"00:09:33,656","00:09:36,700",236_7_train
1928,8858,No-no!,Ross,1,1,887,8,6,17,"0:19:46,651","0:19:47,821",887_8_train
1929,7919,Because... I'm Monica Geller. It was my credit card you were using.,Monica,0,0,797,4,1,21,"00:17:51,862","00:17:59,702",797_4_train
1930,3630,"Okay, Elizabeth Hurely....",Ross,4,1,361,6,3,5,"00:08:32,303","00:08:34,930",361_6_train
1931,1805,"Well, you should be, this is all your fault! You meddled in our relationship!!",Rachel,6,2,182,3,5,10,"00:07:04,757","00:07:11,596",182_3_train
1932,4372,Okay.,All,0,0,446,9,3,19,"0:10:18,701","0:10:20,473",446_9_train
1933,3944,"Nah, Monica’s watching some cooking show. Come on, I don’t want to miss when they were skinny.",Chandler,0,0,403,0,6,19,"00:02:22,892","00:02:26,311",403_0_train
1934,1775,"When you’re done over there, we kinda have a situation over here too.",Chandler,2,2,178,6,6,5,"00:05:55,855","00:05:59,399",178_6_test
1935,738,It—y’know what?,Rachel,0,0,69,12,7,8,"0:20:11,168","0:20:11,920",69_12_dev
1936,9247,You do attract some stinkers.,Joey,3,2,924,6,8,23,"00:16:31,562","00:16:34,815",924_6_train
1937,2997,"The Celtics? Ha. They couldn't hit a boat if...wait. They suck, alright?",Joey,5,2,300,8,1,23,"0:03:59,041","0:04:07,581",300_8_train
1938,1720,I-I am going to,Monica,0,0,173,17,6,17,"00:13:03,407","00:13:07,577",173_17_test
1939,3224,Why would you do that?,Monica,4,1,320,5,6,16,"00:20:11,919","00:20:15,504",320_5_train
1940,3309,I'm sorry.,Phoebe,0,0,331,2,5,2,"00:07:58,561","00:07:59,561",331_2_train
1941,1214,"No-no, this is my collection of fossil samples.",Ross,0,0,124,2,5,6,"00:10:18,993","00:10:21,911",124_2_train
1942,7062,What?!,Ross,1,1,698,6,3,25,"00:17:07,609","00:17:08,735",698_6_train
1943,7115,Calm down? Calm down? You set me up with the woman that I've dumped twice in the last five months!,Chandler,6,2,704,2,1,14,"00:04:31,854","00:04:37,109",704_2_train
1944,2986,Umm?,Chandler,0,0,299,1,3,5,"0:21:47,189","0:21:47,735",299_1_train
1945,752,You betcha!,Phoebe,4,1,76,18,1,7,"00:16:35,536","00:16:36,786",76_18_test
1946,9929,"Are they end to end, or tall like pancakes?",Chandler,0,0,990,4,1,13,"00:13:27,890","00:13:31,184",990_4_train
1947,2247,"Ohh, I mean it’s just so realistic!",Rachel,4,1,229,0,6,16,"00:02:31,818","00:02:34,444",229_0_test
1948,2349,"Uh, uh.",Chandler,0,0,232,8,1,23,"0:05:38,129","0:05:38,761",232_8_train
1949,708,"Well, you-you coulda just turned the cushion over.",Monica,0,0,66,3,3,6,"00:14:36,166","00:14:38,459",66_3_train
1950,9463,"Oh, maybe these’ll taste a little like your grandmother’s.",Monica,6,2,943,1,7,3,"00:13:30,434","00:13:32,477",943_1_train
1951,5031,This is a hospital.,Nurse,0,0,509,8,8,23,"00:01:43,758","00:01:45,760",509_8_train
1952,1725,"Wait, wait, Chandler, this is what you're havin' for Thanksgiving dinner?",Rachel,1,2,175,4,1,9,"00:08:09,405","00:08:12,032",175_4_train
1953,344,"Oh, yeah, you have to tell her.",Chandler,0,0,32,15,1,12,"00:11:43,244","00:11:45,120",32_15_train
1954,5811,"But if—no look, okay. These jerks might not care about you, but the universe does! And that says a lot!",Phoebe,3,2,589,5,7,13,"00:19:13,819","00:19:21,200",589_5_train
1955,9817,Are you jealous?,Ross,1,1,977,2,3,12,"00:21:02,135","00:21:03,177",977_2_train
1956,9891,For him.,Phoebe,0,0,986,5,5,14,"0:03:20,994","0:03:22,008",986_5_train
1957,866,I’m not gonna marry Chandler!,Rachel,6,2,84,2,4,20,"00:21:03,929","00:21:05,888",84_2_train
1958,10079,But then I'd have to go all the way around the dry cleaner place.,Gunther,0,0,1005,12,5,7,"00:15:27,885","00:15:30,178",1005_12_train
1959,2646,"Just do it really fast, and then the wound is exposed.",Phoebe,0,0,262,2,1,5,"00:15:22,922","00:15:26,925",262_2_train
1960,479,I don’t know. Ooh! Ooh! Look it!  Ah-ha!,Phoebe,1,1,46,3,4,19,"00:12:56,942","00:13:04,073",46_3_train
1961,1409,"It’s just y'know, been a couple of hours, and she hasn’t called. Not that I even care, y'know.",Phoebe,3,2,146,1,3,14,"00:11:38,948","00:11:46,538",146_1_train
1962,50,"Ah y'know, this building is on my paper route so I...",Ross,0,0,4,3,3,11,"00:20:26,433","00:20:29,185",4_3_train
1963,791,Yeah.,Phoebe,0,0,74,3,3,23,"0:07:16,656","0:07:18,077",74_3_train
1964,3014,Did you see how he was sweating when he walked out of there?,Rachel,1,2,301,9,1,20,"00:19:54,443","00:19:59,697",301_9_train
1965,2198,"Y’know, hey I understand.",Joey,0,0,218,7,4,11,"0:12:42,511","0:12:43,683",218_7_train
1966,9420,"Why?! You two are so meant to be together, everybody thinks  so.",Phoebe,1,1,939,12,9,1,"00:06:31,391","00:06:35,018",939_12_train
1967,7113,"Ok, I'm makin' a break for it, I'm goin' out the window.",Chandler,0,0,704,0,1,14,"00:04:24,222","00:04:26,765",704_0_train
1968,8200,"Phoebe, what are you doing?",Rachel,1,2,823,3,3,3,"00:16:07,299","00:16:08,716",823_3_train
1969,6916,Oh that’s right. It’s your first day! So are you psyched to fight fake crime with your robot sidekick?,Chandler,4,1,679,9,6,21,"00:00:38,455","00:00:43,584",679_9_train
1970,2768,"Hey, come on now!",Rachel,6,2,276,2,7,11,"0:20:43,867","0:20:45,895",276_2_train
1971,2574,"All right, I’ve heard enough. I’ve made my decision.",Monica,0,0,259,8,6,12,"00:17:01,687","00:17:03,730",259_8_test
1972,7124,"I mean, last year, I spread a little joy but not really enough.",Phoebe,4,1,705,6,5,10,"00:02:46,291","00:02:48,834",705_6_train
1973,5191,"So, whaddya think George is like?",Rachel,0,0,525,5,1,4,"00:16:55,931","00:16:59,267",525_5_train
1974,4321,"All right, I see what you guys are saying. I'll uh, I'll go downstairs and fill out an application.",Ross,0,0,442,3,5,7,"00:14:18,274","00:14:24,028",442_3_train
1975,438,"No, Phoebe, I’ll tell you what, if you get ready now I’ll let you play it at the wedding.",Monica,0,0,45,2,7,1,"00:10:20,494","00:10:22,704",45_2_test
1976,214,Exactly! Unisex!,Rachel,0,0,20,4,5,13,"00:05:16,107","00:05:18,150",20_4_test
1977,1165,"Rachel, it’s going to happen. Chandler is gonna move in here.",Monica,0,0,113,0,6,2,"00:18:52,923","00:18:59,303",113_0_dev
1978,1923,"Yes, I made it!",Ross,4,1,193,0,8,12,"0:17:21,248","0:17:22,250",193_0_test
1979,7731,"Since you have such a great sense of what I need, uh ooh, here’s-here’s 60 bucks, why don’t you take Phoebe down to that Colonial flea market of yours and get me some stuff.",Ross,0,0,777,8,6,11,"00:15:45,319","00:15:57,413",777_8_train
1980,8602,Really?,Chandler,1,1,858,10,4,13,"00:04:49,956","00:04:50,998",858_10_train
1981,4306,"Hey, Rachel, isn't that stuff almost pure...",Monica,0,0,440,13,1,14,"00:13:45,157","00:13:46,658",440_13_train
1982,4879,We’re gonna find love!,Rachel,4,1,499,0,6,25,"0:04:40,446","0:04:42,168",499_0_train
1983,9914,Mrs. Braverman must be out.,Chandler,0,0,989,1,7,11,"00:08:18,789","00:08:21,082",989_1_train
1984,861,How ya doin’?,Joey,0,0,83,1,4,14,"00:15:50,199","00:15:51,616",83_1_train
1985,6757,"Thanks, see you at the party.",Danny,0,0,666,14,5,7,"00:11:48,040","00:11:49,082",666_14_train
1986,9884,Bastard!,Joey,6,2,985,4,6,4,"00:09:38,369","00:09:39,494",985_4_train
1987,4263,Who names their boat Coast Guard anyway?,Joey,5,2,436,3,7,3,"00:06:28,429","00:06:31,056",436_3_train
1988,6227,Uh-huh. Uh-huh.,Joey,0,0,625,3,7,17,"00:11:00,534","00:11:02,035",625_3_train
1989,10182,Your license please.,Policeman,0,0,1014,0,7,22,"00:20:24,640","00:20:26,015",1014_0_train
1990,3987,Ah.,Rachel,0,0,408,0,8,11,"0:01:06,566","0:01:06,828",408_0_train
1991,1239,Here you go honey!,Paul,4,1,126,13,6,22,"00:10:53,819","00:10:55,487",126_13_test
1992,4253,Why would you serve food on such a sharp stick?,Mr. Geller,1,2,435,4,8,18,"0:05:20,017","0:05:23,635",435_4_train
1993,208,Have you seen Chandler?!,Monica,0,0,18,2,6,22,"0:16:18,519","0:16:19,401",18_2_dev
1994,80,"This is a serious, legitimate movie.",Joey,0,0,8,3,7,19,"0:03:24,621","0:03:27,226",8_3_dev
1995,8768,Half a tank? We still got a lot of high-speed chasing to do!,Chandler,1,1,875,3,5,5,"00:07:44,672","00:07:48,383",875_3_train
1996,8015,Keep talking.,Monica,0,0,808,5,7,1,"00:15:19,919","00:15:21,002",808_5_train
1997,490,Y'know what if we went away for a whole weekend?,Chandler,0,0,49,10,5,5,"0:00:51,686","0:00:54,719",49_10_test
1998,772,No.,Chandler,0,0,72,6,4,15,"00:14:54,768","00:14:56,436",72_6_train
1999,10107,It’s too late!,Rachel,6,2,1007,11,3,10,"0:19:13,361","0:19:15,614",1007_11_train
2000,5210,I’m not on the list!,Isabella,1,2,526,14,3,5,"00:20:55,837","00:20:57,171",526_14_train
2001,8074,"Ohh, you're about to get a little luckier.",Monica,4,1,812,9,5,19,"00:21:42,926","00:21:45,594",812_9_train
2002,192,Yeah?,Ross,0,0,18,2,5,21,"0:05:11,603","0:05:12,542",18_2_train
2003,29,"Yeah, we were…we were just looking around.",Guy,0,0,4,1,7,7,"00:14:36,208","00:14:38,001",4_1_dev
2004,638,Hey!,Phoebe,4,1,61,1,3,21,"0:12:47,225","0:12:48,632",61_1_dev
2005,3186,"Phoebe he’s right, that is the rule.",Ross,0,0,317,11,7,11,"00:04:10,500","00:04:12,292",317_11_train
2006,6891,Hey-hey!,Joey,4,1,678,4,3,5,"0:04:20,677","0:04:21,387",678_4_train
2007,4939,I think so too.,Monica,0,0,503,15,5,24,"00:12:50,603","00:12:52,187",503_15_train
2008,7655,"Okay,",Monica,0,0,770,6,5,5,"00:08:34,555","00:08:36,431",770_6_train
2009,1126,"Oh-ho-kay, I’m talking to the king.",Joey,0,0,115,5,3,7,"00:21:43,844","00:21:45,928",115_5_train
2010,5347,"Oh, you like it? You wanna know where I got it?",Ross,4,1,538,6,6,11,"00:09:01,582","00:09:08,213",538_6_train
2011,1008,"Wait a minute, hold it.  Johnson! Will you come in here a moment?",Dr. Rhodes,0,0,102,0,3,23,"00:06:01,152","00:06:08,116",102_0_train
2012,2476,"Well okay, let this be a lesson to all of you, all right.",Phoebe,0,0,250,6,3,14,"00:03:29,667","00:03:31,877",250_6_test
2013,8891,"Hello, is Ross there?",Russell,0,0,890,1,6,4,"0:19:17,490","0:19:18,790",890_1_train
2014,3714,Sperm or regular?,Joey,0,0,371,4,3,3,"0:19:39,178","0:19:41,055",371_4_train
2015,353,I can’t believe it!,Phoebe,1,1,35,0,7,9,"0:21:24,783","0:21:26,494",35_0_train
2016,6788,I'm- I'm Monana!,Monica,4,1,670,11,1,21,"00:16:52,845","00:16:54,512",670_11_train
2017,7371,"I-I, I have to tell you something.",Ross,2,2,736,8,4,17,"00:09:38,536","00:09:41,955",736_8_train
2018,452,With them I’m one hot chicky.,Leslie,4,1,46,5,3,14,"00:12:36,213","00:12:38,840",46_5_test
2019,4836,"I don’t know, I’ve never had to use the other one.",Monica,0,0,493,5,6,23,"00:10:01,809","00:10:04,811",493_5_train
2020,1824,Oo God!,Phoebe,3,2,184,3,8,14,"00:14:41,160","00:14:43,520",184_3_test
2021,1773,"Oh right, Coach Ruben.",Chandler,0,0,178,4,6,5,"0:05:46,857","0:05:48,994",178_4_test
2022,5395,Oh my.,Joey,1,1,542,8,3,21,"0:00:23,321","0:00:23,763",542_8_train
2023,8529,I’ll remember that.,Kristen,0,0,851,14,7,17,"00:06:03,363","00:06:04,821",851_14_train
2024,7818,"Aww, like I could hurt you. Are you making fun of my size? Don't make fun of me because of my size!",Katie,1,1,789,9,5,15,"00:09:22,353","00:09:28,084",789_9_train
