2464,2769,"All right, what are we havin’?",Joey,0,0,276,3,7,11,"00:20:56,505","00:20:59,090",276_3_train
2465,6638,"Okay, okay, what's going on?",Ross,0,0,658,18,1,20,"0:02:50,628","0:02:52,130",658_18_train
2466,9381,"Forget that British chippy.""",Phoebe,3,2,936,12,4,23,"00:20:48,997","00:20:52,792",936_12_train
2467,1133,Yeah.,Sarah,0,0,116,4,3,10,"00:04:54,794","00:04:58,338",116_4_train
2468,983,No!,Cliff,1,2,104,1,8,23,"0:18:53,870","0:18:54,830",104_1_test
2469,1587,"All that stuff you said about true love, you were right, I mean, we did learn a lot from Mom and Dad!",Ross,4,1,163,3,8,18,"00:21:21,601","00:21:26,106",163_3_test
2470,9488,Why?,Monica,1,2,946,1,1,11,"0:00:04,713","0:00:05,095",946_1_train
2471,8329,Also an island.,Ross,0,0,836,3,5,21,"00:02:53,798","00:02:55,215",836_3_train
2472,281,"Aw! Hey, do you think that Susan person is her lover?",Phoebe,0,0,23,8,3,6,"00:18:21,850","00:18:26,854",23_8_dev
2473,6704,Hey Joey! Isn't that the girl that waved at you the other day?,Monica,0,0,663,9,5,17,"00:14:44,508","00:14:47,760",663_9_train
2474,489,"Seriously, good game though. Good game.   What are they so mad about? They get the apartment back!",Joey,1,2,46,13,4,19,"00:13:39,485","00:13:49,619",46_13_train
2475,7945,"Um, the doctor says it's gotta be a needle.",Monica,0,0,801,0,2,6,"00:10:06,647","00:10:10,817",801_0_train
2476,6074,"Oh, okay. Will you take my place?",Rachel,0,0,611,5,1,4,"00:22:03,030","00:22:06,907",611_5_train
2477,7175,"Well, yes! Just give me five minutes, I just have to find someone to cover my shift.",The Librarian,4,1,714,1,7,7,"00:09:51,757","00:09:58,138",714_1_train
2478,11,On the touchy.,Phoebe,0,0,1,8,4,4,"0:12:55,002","0:12:55,824",1_8_dev
2479,5664,"Including umm, evil bitch and uh, sick bastard.",Rachel,5,2,572,1,8,23,"00:09:17,128","00:09:22,425",572_1_train
2480,9101,I’m Trudie.,Trudie Styler,0,0,909,3,8,10,"0:15:35,809","0:15:36,571",909_3_train
2481,4588,"The kid...?  Excuse me, uh, that's, that's my puck.",Ross,6,2,466,9,1,4,"00:20:43,700","00:20:46,786",466_9_train
2482,3013,Hating you!,Rachel,6,2,301,8,1,20,"0:19:52,441","0:19:53,301",301_8_train
2483,6752,We'll be right there!  Can't you just say it starts later?,Monica,6,2,666,9,5,7,"00:11:29,730","00:11:32,315",666_9_train
2484,2401,"Alright, alright, alright.",Chandler,0,0,242,0,1,7,"0:03:54,651","0:04:00,616",242_0_test
2485,1008,"Oh, you've tasted it.",Ross,6,2,94,9,2,2,"00:13:48,410","00:13:50,245",94_9_dev
2486,9665,"Yeah, I'm gonna stay and read my book. I just wanna be alone right now.",Ross,3,2,961,10,5,12,"00:06:22,340","00:06:28,345",961_10_train
2487,703,And if you bring in one woman and she has her baby before me I’m going to sue you!,Rachel,6,2,72,9,8,23,"00:19:32,117","00:19:36,246",72_9_test
2488,6892,Hey.,Frank,0,0,678,5,3,5,"0:04:21,387","0:04:22,701",678_5_train
2489,1539,Oh Phoebe!,Rachel,4,1,156,9,8,2,"0:14:29,785","0:14:30,427",156_9_train
2490,1360,"Yeah, what's up with that girl Monica?",A Female Student,0,0,139,1,5,9,"00:21:42,426","00:21:44,385",139_1_train
2491,4685,"No, I-I’m saying I liked her.",Ross,4,1,477,7,3,24,"00:14:36,750","00:14:39,168",477_7_train
2492,4943,Is there anything we can do for you?,Phoebe,0,0,504,3,8,9,"0:21:19,778","0:21:21,113",504_3_train
2493,1349,"I overheard you guys on the phone the other day, and you said, ""I'll just tell Rachel that I'm doing laundry for a couple of hours.""",Rachel,0,0,138,7,5,12,"00:12:14,650","00:12:21,531",138_7_train
2494,6923,I’ll be waiting.,Phoebe,0,0,679,16,6,21,"00:01:11,154","00:01:12,446",679_16_train
2495,9740,Whoa-hey-oh! Sorry!,Joey,1,2,967,9,8,14,"00:03:37,760","00:03:39,720",967_9_train
2496,1683,Oh my God! I know who the father is,Phoebe,1,2,169,21,8,2,"00:12:54,940","00:12:59,194",169_21_test
2497,6797,I just...,Ross,0,0,671,4,9,21,"00:16:17,017","00:16:21,020",671_4_train
2498,2948,How could I forget?,Ross,1,1,296,3,1,2,"0:14:46,690","0:14:47,832",296_3_train
2499,7855,So what about us? Everything we feel for each other.,Joey/Drake,3,2,792,13,9,19,"00:10:09,443","00:10:12,696",792_13_train
2500,892,Hi.,Monica,0,0,87,5,1,5,"00:22:08,744","00:22:09,744",87_5_train
2501,2682,He might still show up.,Monica,0,0,265,1,7,7,"00:11:47,832","00:11:49,082",265_1_train
2502,9065,Oh! That's why.  I'm sorry!,Rachel,1,1,906,5,1,15,"00:00:19,269","00:00:23,814",906_5_train
2503,7526,Down at the docks again?,Rachel,6,2,754,4,3,3,"00:11:25,976","00:11:28,019",754_4_train
2504,1495,That is a good one!,Ross,4,1,154,11,8,11,"0:02:40,641","0:02:41,920",154_11_test
2505,6594,No! No! It’s wrong! It’s-it’s-it’s naughty. It’s taboo.,Ross,4,1,655,13,6,18,"00:21:05,389","00:21:11,769",655_13_train
2506,599,Of course he’s gonna have his Uncle Joey!,Joey,4,1,54,17,8,10,"00:20:36,860","00:20:40,655",54_17_train
2507,4862,"No you guys, I am not getting in a car with him, you’ll have to think of something else.",Rachel,6,2,496,12,3,17,"00:14:19,692","00:14:24,904",496_12_train
2508,557,"Sure, New Year’s Eve is only two weeks away. Can you wait?",Janine,0,0,53,3,6,10,"00:20:02,451","00:20:06,996",53_3_dev
2509,8280,"Oh, on a date. Yeah, I met this girl on the train going to a museum upstate.",Ross,0,0,832,5,4,10,"00:00:20,729","00:00:24,440",832_5_train
2510,6831,So that’s your second marriage in two years.,Russell,0,0,673,2,6,2,"00:15:09,116","00:15:12,702",673_2_train
2511,498,Sounds like two people are really enjoying the Dewey decimal system.,Chandler,0,0,50,1,7,7,"00:02:49,335","00:02:53,422",50_1_test
2512,4481,They put you in jail?,Chandler,1,2,456,5,6,23,"0:13:20,925","0:13:21,117",456_5_train
2513,3748,Who are you?,Man,1,2,374,5,8,3,"0:15:36,685","0:15:37,520",374_5_train
2514,3471,"Oh come on guys, it’s not like I moved to Europe! I just moved across the hall! And",Chandler,4,1,346,0,6,20,"00:08:20,374","00:08:25,629",346_0_train
2515,6837,"Yes-yes-yes! But, I-I do",Ross,0,0,673,8,6,2,"00:15:41,941","00:15:43,942",673_8_train
2516,6393,Let’s grab our stuff and get the hell out of here.,Ross,0,0,638,6,7,13,"00:06:19,462","00:06:22,339",638_6_train
2517,3374,"Okay, the other night I was leaving the museum just as ‘Laser Floyd’ was letting out of the planetarium, without even trying I sold 50 boxes!",Ross,4,1,336,15,3,10,"00:12:59,987","00:13:09,788",336_15_train
2518,729,"Oh please!   You’re gonna say things now, aren’t ya?",Ross,4,1,67,11,6,3,"00:08:55,701","00:08:58,495",67_11_train
2519,8245,What?,Rachel,1,2,828,5,1,5,"00:11:03,913","00:11:04,954",828_5_train
2520,8196,"Oh no wait, I'm sorry, that's 'pretty dumb.'",Phoebe,0,0,822,8,3,4,"0:18:12,800","0:18:14,238",822_8_train
2521,1436,"What rule? There's no rule, if anything, you owe me a table!",Chandler,6,2,148,2,1,12,"00:07:37,999","00:07:41,543",148_2_train
2522,6228,"That’s interesting, but check this out. I date her",Ross,4,1,625,4,7,17,"00:11:06,123","00:11:10,585",625_4_train
2523,6247,"Thank you soo, much.",Monica,4,1,626,3,3,6,"00:11:04,288","00:11:05,622",626_3_train
2524,9816,Oh.,Rachel,0,0,977,1,3,12,"0:20:55,640","0:20:57,439",977_1_train
2525,1617,I-I’ll go tell her now before Ross  finds out and I’ll be gentle.,Joey,0,0,166,9,9,1,"00:16:07,508","00:16:11,511",166_9_test
2526,1154,"What are you talking about?  She obviously lives on the second floor, seventh apartment from the left!",Monica,1,1,119,7,5,17,"00:15:05,446","00:15:10,633",119_7_train
2527,8718,Okay! We’ll need a six-pack of,Joey,0,0,870,6,4,22,"00:05:04,345","00:05:07,556",870_6_train
2528,5108,Uh Phoebe?,Monica,3,2,517,5,8,14,"00:22:02,040","00:22:05,840",517_5_train
2529,9587,Bob?,Phoebe,2,2,953,10,9,12,"0:08:39,101","0:08:39,663",953_10_train
2530,1681,I’m such a jerk.,Joey,3,2,170,10,3,6,"00:13:12,249","00:13:14,083",170_10_train
2531,5009,No problem.,Joey,0,0,508,9,5,18,"0:16:53,114","0:16:53,686",508_9_train
2532,1613,Oh no-no-no.,Chandler,0,0,165,2,4,7,"00:14:18,566","00:14:21,651",165_2_train
2533,2666,I’m going crazy! Okay? Do you have any thing around here that looks homemade?,Chandler,2,2,264,8,6,17,"00:09:52,216","00:09:56,219",264_8_train
2534,371,I can't believe that Ross is gone. It is just so sad.,Kori,3,2,31,0,9,17,"00:22:08,315","00:22:11,902",31_0_dev
2535,1429,This is basically the first time she's gonna see your underwear—you want it to be dirty?,Chandler,1,2,147,8,1,5,"00:07:42,420","00:07:46,548",147_8_train
2536,551,"Come on! Come on! Here, okay-okay, you see this?  This tiny thing that looks like a peanut?",Ross,4,1,56,5,8,3,"00:20:37,861","00:20:43,199",56_5_test
2537,2342,"Can you believe it? I mean, don't I seem like somebody who should be doing something really",Chandler,6,2,237,8,1,15,"00:07:50,970","00:07:56,475",237_8_test
2538,3282,Because I’m not going to spend one more day with someone whose out to sabotage my every move.,Jill,6,2,328,1,6,14,"00:21:20,279","00:21:25,658",328_1_train
2539,257,What? Honey.,Monica,0,0,25,0,3,21,"00:04:13,503","00:04:15,170",25_0_test
2540,2717,I can’t figure this out!,Chandler,6,2,273,1,6,23,"0:00:05,380","0:00:06,465",273_1_train
2541,1896,That’s a mailman! That’s,Chandler,1,2,190,2,4,15,"0:00:16,308","0:00:18,926",190_2_test
2542,830,Go ahead.,Mike,0,0,89,0,8,19,"00:04:08,000","00:04:10,000",89_0_test
2543,8611,Okay.,Phoebe,0,0,860,1,8,17,"00:13:21,759","00:13:23,218",860_1_train
2544,2556,So did you do it?,Janice,1,1,253,6,9,21,"0:17:52,196","0:17:53,658",253_6_train
2545,6871,What are you going to tell her?,Rachel,3,2,676,3,5,5,"0:10:16,488","0:10:18,819",676_3_train
2546,7383,"Where is that book that you are reading with the two women who were ice-skating and wearing, wearing those hats with the flowers on it?",Chandler,0,0,737,6,7,12,"00:04:25,598","00:04:32,521",737_6_train
2547,804,Do we have a name yet?,Dr. Long,0,0,77,0,8,24,"0:09:57,918","0:09:59,128",77_0_train
2548,190,"Hey, you wanna get something to eat or uh, do you wanna see how long we can throw this ball back and forth? Huh?",Ross,0,0,18,0,5,21,"00:05:05,096","00:05:09,474",18_0_train
2549,3949,"I uh, oh! Because, uh, I haven’t really paid the bill",Joey,3,2,404,4,6,12,"00:02:51,546","00:02:55,174",404_4_train
2550,8246,"No suds, no save. Ok?",Woman,6,2,828,6,1,5,"00:11:06,123","00:11:09,292",828_6_train
2551,1087,I bet this will work!,Monica,4,1,104,6,5,8,"00:20:43,867","00:20:45,660",104_6_dev
2552,1044,Hey!,Rachel,1,1,97,18,3,20,"0:05:19,068","0:05:20,960",97_18_dev
2553,488,Tickets please!  That’s courtside baby!,Chandler,4,1,46,12,4,19,"00:13:32,561","00:13:39,317",46_12_train
2554,400,"Who, Josh?",Phoebe,1,2,41,3,4,14,"0:17:40,267","0:17:41,359",41_3_test
2555,9858,"Oh yeah! Okay, let’s play again.  What do you got?",Chandler,0,0,982,5,6,6,"0:11:46,837","0:11:48,845",982_5_train
2556,1271,Yeah?,Ross,4,1,130,5,4,21,"0:02:46,255","0:02:46,751",130_5_test
2557,321,What?,Ross,0,0,30,13,6,21,"0:05:01,779","0:05:03,485",30_13_train
2558,1505,"I mean, I don’t feel like I even have a girlfriend anymore.",Ross,6,2,155,0,3,15,"00:11:51,961","00:11:54,587",155_0_test
2559,565,"Okay, but wouldn’t it be easier if you had to tell me something that you could tell me.",Monica,0,0,52,4,3,21,"00:13:02,490","00:13:13,917",52_4_train
2560,2285,"So Mon, when are we gonna meet this new secret waiter man?",Rachel,0,0,232,2,5,4,"00:06:02,653","00:06:06,907",232_2_test
2561,1414,"Okay, well I do know you.",Monica,0,0,146,6,3,14,"0:11:55,131","0:11:56,633",146_6_train
2562,576,"Ohh… Oh, that’s okay I hate when people come back to complement the chef.",Monica,0,0,53,3,6,24,"00:20:49,915","00:20:53,459",53_3_train
2563,6791,What?,Rachel,0,0,670,14,1,21,"00:17:25,419","00:17:26,919",670_14_train
2564,9035,All right.,Monica,0,0,904,0,4,15,"0:21:19,653","0:21:20,585",904_0_train
2565,1,also I was the point person on my company’s transition from the KL-5 to GR-6 system.,Chandler,0,0,0,0,8,21,"00:16:16,059","00:16:21,731",0_0_train
2566,9315,Hey!,Rachel,4,1,932,2,9,20,"0:22:11,943","0:22:12,585",932_2_train
2567,9894,Joey! Come here! Come here!,Rachel,0,0,986,8,5,14,"0:03:26,717","0:03:28,303",986_8_train
2568,4534,Okay.  My word! Those are snug.,Chandler,1,2,462,8,3,5,"00:00:39,164","00:00:42,041",462_8_train
2569,3919,...pig...pig man!,Rachel,5,2,399,0,1,19,"00:15:46,403","00:15:48,738",399_0_train
2570,7807,"Y’know so umm, he’s closed the drapes there so he can have a nice, pleasant conversation with your little sister.",Chandler,0,0,788,3,6,13,"00:21:03,804","00:21:13,771",788_3_train
2571,6504,"Ohh, Lilies. Joey, they’re my favorite. Thank you.",Rachel,4,1,649,2,8,12,"00:04:32,188","00:04:36,900",649_2_train
2572,1173,"No! No-no! He is totally incompetent. I called the chef who recommended him to me. He said, ""Ha-ha! Gotcha!""",Monica,5,2,123,2,8,5,"00:08:32,094","00:08:39,017",123_2_test
2573,7465,Maybe you can tell me.,Joey,0,0,745,6,3,4,"00:02:11,047","00:02:13,924",745_6_train
2574,4207,I haven’t seen it yet!,Rachel,0,0,430,6,6,2,"00:02:12,132","00:02:13,966",430_6_train
2575,2433,"Umm, how’s it going with you guys?",Chandler,0,0,244,18,3,6,"0:03:33,796","0:03:34,923",244_18_test
2576,1031,"Anyway, I figured after work I'd go pick up a bottle of wine, go over there and, uh, try to woo her.",Ross,4,1,110,7,1,19,"00:05:39,672","00:05:47,554",110_7_test
2577,3639,Oh that’s five Ross. Five women have had five babies! And I have had no babies! Why doesn’t she want to come out?,Rachel,3,2,362,0,8,24,"00:04:22,542","00:04:32,969",362_0_train
2578,4662,I clunked your heads together!,Monica,0,0,475,16,9,23,"00:32:04,547","00:32:07,841",475_16_train
2579,6677,Oh!,Rachel,1,1,660,15,6,23,"00:07:12,473","00:07:14,182",660_15_train
2580,549,"Hey, how you doin’?",Joey,0,0,50,16,6,21,"00:14:44,550","00:14:47,010",50_16_train
2581,5734,"That would be the basic ‘I have a fishhook in my eyebrow and I like it’  Okay, let’s say I’ve just gotten bad news, well all I do there is try and divide 232 by 13.",Joey,0,0,577,3,3,7,"00:12:45,264","00:13:02,363",577_3_train
2582,1558,I did not cry my eyes out!!,Joey,6,2,160,9,6,2,"0:14:44,925","0:14:48,227",160_9_test
2583,7430,"Okay, grab…grab some empty boxes.",Ross,0,0,740,11,7,13,"00:12:41,302","00:12:46,014",740_11_train
2584,4752,We found your fire alarm in the trash chute.,The Fireman,6,2,482,2,7,12,"0:18:20,850","0:18:22,910",482_2_train
2585,4193,"Hi, Joey. Well well, look what you brought. Very nice.",Lorraine,4,1,429,4,1,14,"00:03:33,713","00:03:41,511",429_4_train
2586,1280,More tea?,Emily,0,0,130,14,4,21,"0:03:14,986","0:03:15,618",130_14_test
2587,9010,What?,Chandler,1,2,901,15,3,8,"00:07:52,930","00:07:54,306",901_15_train
2588,8520,"Oh wow, what a beautiful name!  What is it again?",Joey,4,1,851,5,7,17,"00:05:42,550","00:05:48,347",851_5_train
2589,9039,I officially give up.,Monica,5,2,904,4,4,15,"0:21:31,373","0:21:32,395",904_4_train
2590,8630,What?,Monica,1,1,861,4,1,8,"00:04:18,299","00:04:19,424",861_4_train
2591,10290,"Where do you think,  Zelda?",Joey,0,0,1022,7,7,2,"00:07:48,050","00:07:49,718",1022_7_train
2592,5630,Bye!,All,0,0,568,3,5,14,"0:09:16,389","0:09:17,155",568_3_train
2593,6922,I think our lover’s spat will start a little early this month.,Monica,6,2,679,15,6,21,"00:01:08,109","00:01:10,986",679_15_train
2594,2515,Look at this!,Chandler,4,1,250,1,1,15,"00:15:06,113","00:15:07,780",250_1_train
2595,43,You had no right to tell me you ever had feelings for me.,Ross,6,2,5,0,2,7,"00:18:28,565","00:18:31,234",5_0_dev
2596,8675,"But-but, if you don’t love this, we’ll do it in any other place at any other time.",Ross,0,0,866,5,4,23,"00:19:54,985","00:19:56,027",866_5_train
2597,6182,New people.,Rachel,0,0,621,1,8,23,"0:08:48,784","0:08:49,118",621_1_train
2598,5262,I think that a person should know where they come from.,Phoebe Sr,0,0,530,19,3,25,"00:20:00,991","00:20:03,951",530_19_train
2599,1226,It’s so secluded up here.,Rachel,0,0,126,0,6,22,"00:10:03,894","00:10:05,645",126_0_test
2600,942,"Well, Phoebe I thought I’d——Yeah, what the hell.",Chandler,0,0,88,5,8,14,"00:01:26,360","00:01:30,160",88_5_dev
2601,1516,"Oh, my ex-wife didn’t work, unless you call turning into her mother work. Fine. Tomorrow night then.",Doug,0,0,156,2,8,11,"00:10:41,432","00:10:51,524",156_2_test
2602,182,And I’m appalled for you by the way.,Monica,6,2,17,10,3,7,"00:02:56,050","00:02:58,886",17_10_test
2603,2606,Well...,Pete,0,0,262,4,3,21,"0:02:53,798","0:02:55,220",262_4_test
2604,3512,"Anyway, I should go, one of the lifeguards was just about to dismantle a nuclear device.",Chandler,0,0,350,4,3,6,"00:19:16,780","00:19:22,243",350_4_train
2605,5835,"Okay, I know. Hold on.  Hey Ross?",Phoebe,0,0,590,12,7,5,"00:08:55,117","00:08:59,162",590_12_train
2606,349,"I mean, y’know, I’m just waiting for the perfect guy.",Monica,0,0,34,8,6,15,"00:18:28,899","00:18:30,983",34_8_test
2607,9366,Anybody lose this?,Monica,0,0,935,11,5,23,"00:17:01,645","00:17:04,063",935_11_train
2608,5898,"What?! No, you can’t, you can’t leave me here with them! We’re baby-sitting!",Phoebe,6,2,596,8,6,5,"00:14:08,973","00:14:12,642",596_8_train
2609,7587,Did you just flick me?,Monica,6,2,761,0,2,13,"00:10:28,044","00:10:29,711",761_0_train
2610,4866,"Yeah, well, you’re wrong! Okay, you’re wrong.",Chandler,6,2,497,1,3,8,"00:08:04,317","00:08:06,234",497_1_train
2611,8103,"I-I am so sorry, I’ll go.",Janice,3,2,816,2,7,7,"00:20:52,084","00:20:57,421",816_2_train
2612,988,"Oh yeah, Smokey Joe here got half way to the highway and collapsed.",Joey,6,2,106,0,3,17,"00:14:32,663","00:14:36,541",106_0_test
2613,255,"What should I wear, now I’m all nervous.",Ross,2,2,24,8,3,14,"00:11:15,549","00:11:19,969",24_8_train
2614,1004,Cantaloupe juice.,Susan,4,1,94,5,2,2,"00:13:31,560","00:13:33,686",94_5_dev
2615,2131,"You just ahh, you just need more practice.",Joey,0,0,214,2,4,4,"00:14:36,458","00:14:37,959",214_2_test
2616,2498,"I mean, no, you’re right.",Ross,3,2,252,11,4,1,"0:12:15,656","0:12:17,871",252_11_test
2617,5462,"Oh that’s too bad. I’ve kinda been saving up.  Uh, are you sure there’s no studies I can participate in?",Joey,3,2,549,2,6,17,"00:07:13,641","00:07:23,191",549_2_train
2618,3646,What?,Rachel,1,2,362,7,8,24,"00:05:07,044","00:05:08,838",362_7_train
2619,216,What are you gonna do?,Phoebe,0,0,18,9,6,22,"0:16:37,830","0:16:38,831",18_9_dev
2620,6114,Well then let's just quit! We'll just quit! Let's all quit!,Rachel,4,1,614,8,5,18,"00:15:00,691","00:15:03,359",614_8_train
2621,5194,Yeah. I think you have to draw him out. And then- when you do- he's a preppy animal.,Monica,0,0,525,8,1,4,"00:17:01,979","00:17:08,735",525_8_train
2622,2455,"Why would you ruin it, who was that hurtin'?",Joey,5,2,241,13,9,22,"0:02:03,749","0:02:05,578",241_13_train
2623,6595,Shut the book!,Elizabeth,4,1,655,14,6,18,"00:21:12,479","00:21:14,355",655_14_train
2624,3084,So basically this is very easy. You read from the script and try to sell as much toner as you possibly can.,Supervisor,0,0,308,0,7,13,"00:04:13,544","00:04:19,341",308_0_train
2625,3850,"You know that’s nice, y'know we could put it back there after the surgeons remove it from your colon!",Monica,6,2,388,16,3,5,"00:06:56,165","00:07:01,378",388_16_train
2626,4794,"Ooh, it’s probably a residual check, hey can you open it for me, I’m kinda….",Joey,0,0,486,3,6,4,"00:06:18,461","00:06:22,422",486_3_train
2627,2605,Wow! You’re a lot sturdier that Chandler. He crumpled like a piece of paper. So how was you’re trip?,Monica,1,1,262,3,3,21,"00:02:47,667","00:02:53,630",262_3_test
2628,5708,But it is a big deal!! I have to tell someone!,Joey,1,2,574,13,5,5,"00:20:41,865","00:20:45,576",574_13_train
2629,1510,"All right that's, that's it!! Get off her!",Ross,6,2,154,2,3,12,"0:14:14,186","0:14:16,248",154_2_train
2630,419,"Okay, so you were trying to play bad this whole time.",Monica,1,1,42,7,4,7,"00:21:56,606","00:21:58,858",42_7_test
2631,1537,There you go sweetie...     This isn't over.,Joey,0,0,157,7,9,17,"00:06:25,456","00:06:31,504",157_7_test
2632,1718,Oh..please!I-I welcome criticism.,Monica,0,0,174,5,9,19,"00:06:10,871","00:06:15,501",174_5_train
2633,6782,"Yes, yes, it does. Okay, look, the restaurant called, they wanna know if you're gonna be showing up for work?",Rachel,0,0,670,5,1,21,"00:16:25,109","00:16:31,531",670_5_train
2634,48,Hi!,Ross,4,1,4,1,3,11,"0:20:24,891","0:20:25,028",4_1_train
2635,2548,"I mean, San Diego's all well and good, but if you give him to me, I'll start him off against a blind rabbit and give you twenty percent of the gains.",Dr. Baldhara,0,0,252,19,1,21,"00:15:23,047","00:15:28,551",252_19_train
2636,284,It’s kind of embarrassing.,Phoebe,0,0,28,6,8,23,"0:12:52,302","0:12:53,656",28_6_test
2637,26,Yeah!!,Ross,4,1,3,1,5,20,"0:01:02,271","0:01:03,961",3_1_dev
2638,6816,"Well, I wanted to be thorough.",Ross,0,0,672,4,4,1,"0:07:25,457","0:07:27,500",672_4_train
2639,2639,"Uh-huh, well! But umm, still I’m-I’m mad at you.",Phoebe,6,2,261,4,4,1,"00:19:14,486","00:19:19,866",261_4_train
2640,148,You don’t think this is too fast.,Mona,0,0,14,5,8,11,"00:14:16,897","00:14:20,316",14_5_train
2641,7703,Men are here.,Chandler,0,0,773,2,1,24,"00:02:36,447","00:02:38,365",773_2_train
2642,9421,Really?! Even Ross?,Rachel,1,2,939,13,9,1,"00:06:35,186","00:06:37,646",939_13_train
2643,3569,Hey.,Chandler,0,0,356,5,3,3,"0:01:28,046","0:01:28,186",356_5_train
2644,3256,"Oh, and then Monica joked that she wouldn’t go out with a guy like Chandler...",Joey,0,0,324,2,4,1,"00:00:11,720","00:00:14,430",324_2_train
2645,128,"And Mon, you wanna live with Chandler, don’t ya?",Ross,0,0,12,17,6,3,"00:13:56,710","00:13:59,045",12_17_test
2646,7880,Now just tell Emily that I love her and that I can’t imagine spending my life with anyone else.,Ross,6,2,794,6,5,1,"00:14:15,855","00:14:18,815",794_6_train
2647,6998,"Good runnin’ into you at the bank today, so ah, here’s my number, 555-9323. Give me a call. Later.",Chip,0,0,689,4,4,2,"00:01:42,519","00:01:48,023",689_4_train
2648,7907,"Chandler, I…",Ms. McKenna,4,1,796,13,9,2,"0:14:11,183","0:14:12,155",796_13_train
2649,9088,"Joey come—I can’t believe—I bring you here to see the Bapstein-King comet, one of nature’s most spectacular phenomenon, and all you care about are bugs stuck in tar and-and some woman!",Ross,6,2,908,7,7,12,"00:02:41,077","00:02:52,379",908_7_train
2650,179,I’m gonna work on that.,Whitney,0,0,16,5,7,5,"00:20:08,749","00:20:09,957",16_5_dev
2651,1370,"Rachel! Well, you-you’re not at home, you’re-you’re-you’re right here.",Ross,1,1,139,7,6,13,"00:19:03,016","00:19:11,440",139_7_test
2652,1428,"Well, you may wanna rethink the dirty underwear.",Chandler,5,2,147,7,1,5,"00:07:37,790","00:07:41,126",147_7_train
2653,10013,"What? I-I bought groceries, I was gonna make you dinner!",Monica,4,1,997,2,6,22,"00:12:53,439","00:12:55,857",997_2_train
2654,9790,"Just-just, you know, the-the lovely waterfalls, and the, the trickling fountains.",Phoebe,4,1,973,16,3,1,"00:13:38,067","00:13:40,610",973_16_train
2655,9821,I'm not jealous.,Rachel,6,2,977,6,3,12,"0:21:18,777","0:21:21,089",977_6_train
2656,5492,Right.,Ross,0,0,553,5,6,10,"00:08:42,021","00:08:43,146",553_5_train
2657,8916,"Oh, I cannot wait to read the front page of the Post tomorrow!",Monica,4,1,892,14,8,21,"00:04:33,983","00:04:37,194",892_14_train
2658,2576,"The joke is not funny, and it’s offensive to women, and doctors, and monkeys!",Monica,5,2,259,10,6,12,"00:17:09,653","00:17:14,615",259_10_test
2659,579,"Y’know, I don’t have an appointment, but I sure could use a physical.  Are you sure you’re okay?",Monica,0,0,58,15,6,16,"00:15:19,543","00:15:31,137",58_15_test
2660,1305,"No! Sorry, I just thought you were somebody else. Hi!",Rachel,1,1,132,0,3,15,"00:16:06,924","00:16:10,677",132_0_train
2661,898,"Oh, you got the whole night, huh?",Monica,1,1,96,12,1,6,"00:12:49,894","00:12:51,644",96_12_test
2662,1389,"Oh, Danielle! I wasn't expecting the machine... Give me a call when you get a chance.  Bye-bye.  Oh God!",Chandler,1,2,145,0,1,20,"00:05:09,309","00:05:21,320",145_0_train
2663,10452,No!,Joey,6,2,1036,15,5,22,"00:19:52,441","00:19:54,192",1036_15_train
2664,8238,Hello! Organic substances recently discovered in the depths of the rain forest!,Monica,4,1,827,14,3,16,"00:05:30,455","00:05:33,874",827_14_train
2665,5676,"No-no, I’m…I’m sure no one was looking. Just want some privacy.",Ross,0,0,572,13,8,23,"00:09:49,785","00:09:53,831",572_13_train
2666,5195,"Hi! Hi, I’m Ross, you don’t know me, but I’m a big, big fan of yours. I mean,",Ross,4,1,526,0,3,5,"00:19:49,396","00:19:56,944",526_0_train
2667,8241,"Oh, 'scuse me. I was kinda using that machine.",Rachel,4,1,828,1,1,5,"00:10:45,269","00:10:48,647",828_1_train
2668,5307,"Uh actually, I’d like to speak with both of you.",Mr. Zelner,0,0,533,8,7,9,"00:16:47,923","00:16:50,591",533_8_train
2669,1049,Yeah? The work problem?,Monica,0,0,108,3,8,17,"00:11:52,044","00:11:54,379",108_3_train
2670,285,Let’s just say there was a typographical error with a sex manual.,Phoebe,4,1,28,7,8,23,"00:12:53,761","00:12:57,848",28_7_test
2671,204,"Oh, unbelievable! We had the best time!",Joey,4,1,20,1,7,7,"00:10:59,408","00:11:01,368",20_1_train
2672,7701,"OK, we got the cole slaw, we got the buns...",Monica,0,0,773,0,1,24,"00:02:27,605","00:02:30,232",773_0_train
2673,9075,Who are you talking too?,The Smoking Woman,1,2,907,8,5,16,"00:07:01,170","00:07:04,089",907_8_train
2674,2103,He went out with my wife!,The Dry Cleaner,6,2,211,2,6,22,"0:17:13,074","0:17:13,956",211_2_test
2675,972,Not even if you just pretend that it's milk?,Phoebe,0,0,91,9,2,2,"00:09:37,493","00:09:39,703",91_9_dev
2676,6983,Okay. Sorry.,Monica,0,0,686,10,7,23,"0:13:00,125","0:13:00,537",686_10_train
2677,4205,What was that?!,Rachel,1,2,430,4,6,2,"00:02:05,583","00:02:07,126",430_4_train
